text,1-RAPPORT,2-NEGOTIATE,3-EMOTION,4-LOGIC,5-AUTHORITY,6-SOCIAL,7-PRESSURE,8-NO-PERSUASION
How much would you like to donate today?,0,1,0,0,0,0,0,0
hi!,0,0,0,0,0,0,0,1
do you have any particular hobbies or passions?,1,0,0,0,0,0,0,0
have you heard about it?,0,0,0,0,0,0,0,1
you can always help save the life of a child by donating through this task.,0,1,0,0,0,0,0,0
it can be anywhere from 1 cent to the entire possible payment of $2.,0,1,0,0,0,0,0,0
Hello!,0,0,0,0,0,0,0,1
It is a lovely day.,1,0,0,0,0,0,0,0
You can choose any of your $2 bonus to Save the Children.,0,1,0,0,0,0,0,0
Would you be willing to donate a portion of your bonus?,0,1,0,0,0,0,0,0
Well that is very kind of you!,1,0,0,0,0,0,0,0
"If you choose to donate 5%, that is $.01.",0,1,0,0,0,0,0,0
You would like to donate $.01? ,0,1,0,0,0,0,0,0
I agree completely.,1,0,0,0,0,0,0,0
I wish I could do more to help homeless people and veterans myself.,1,0,0,0,0,0,0,0
And I think it starts with selfless people like yourself.,1,0,0,0,0,0,0,0
hi,0,0,0,0,0,0,0,1
so you gonna donate or what,0,1,0,0,0,0,0,0
you gotta donate your payment,0,1,0,0,0,0,0,0
they need your help.,0,0,1,0,0,0,0,0
its just 2 bucks.,0,1,0,0,0,0,0,0
"or ill tell you what, how about just half?",0,1,0,0,0,0,0,0
"also, i think you should be a little bit more generous, come on bro, 1 dollar wont kill you.",0,1,0,0,0,0,0,0
sounds good thanks,1,0,0,0,0,0,0,0
When is this over?,0,0,0,0,0,0,0,1
how many has it been?,0,0,0,0,0,0,0,1
Would you like to donate some of your earnings to the charity Save the Children?,0,1,0,0,0,0,0,0
How much of the $2 payment for this task would you like to donate?,0,1,0,0,0,0,0,0
I hope you have a nice day!,1,0,0,0,0,0,0,0
Are you planning anything exciting this week?,1,0,0,0,0,0,0,0
I hope you have a nice time!,1,0,0,0,0,0,0,0
I'm glad you had a relaxing week!,1,0,0,0,0,0,0,0
"And thank you, I'm sure this week will be relaxing for me as well.",1,0,0,0,0,0,0,0
You can donate as little as a $1,0,1,0,0,0,0,0,0
So yes you can less,0,1,0,0,0,0,0,0
"I am fine thanks, It's not been a long time I am on MTurk, but It is interesting how they are working on donating, Are you interested in donating?",0,1,0,0,0,0,0,0
that is so nice of you.,1,0,0,0,0,0,0,0
I agree with you.,1,0,0,0,0,0,0,0
thank you for putting time on effort on this.,1,0,0,0,0,0,0,0
Thanks for your attention and help.,1,0,0,0,0,0,0,0
It was such a pleasure to chat with you.,1,0,0,0,0,0,0,0
Have a nice day!,1,0,0,0,0,0,0,0
 haw are you,0,0,0,0,0,0,0,1
yes i donate very much money,1,0,0,0,0,0,0,0
 very good for you,1,0,0,0,0,0,0,0
" i am pleasure for my charity, all the best for you",1,0,0,0,0,0,0,0
Highly recommend it! ,0,1,0,0,0,0,0,0
This helps those children heal,0,0,1,0,0,0,0,0
 That is fantastic! ,1,0,0,0,0,0,0,0
I\'m so glad to hear that. ,1,0,0,0,0,0,0,0
I don\'t want to be overbearing but typically people will donate $2. ,0,0,0,0,0,1,0,0
 That extra dollar means so much more to them than you or I. ,0,0,0,1,0,0,0,0
 I'm sure you'd like to be apart of keeping at least a few more alive?  ,0,0,1,0,0,0,0,0
1.25 is great!  ,1,0,0,0,0,0,0,0
I make sure your donation is set at 1.25.  ,0,1,0,0,0,0,0,0
 Have you ever heard of Save the Children?,1,0,0,0,0,0,0,0
How much would you like to donate now? ,0,1,0,0,0,0,0,0
Sure. ,0,0,0,0,0,0,0,1
Right now millions of Syrian children have grown up facing violence every day. ,0,0,1,0,0,0,0,0
I turn to tears when I see children suffering. ,0,0,1,0,0,0,0,0
I don't work for them. ,1,0,0,0,0,0,0,0
I only communicate through this platform to help them.,1,0,0,0,0,0,0,0
How much would you like to donate? ,0,1,0,0,0,0,0,0
"You know whatever amount you choose, the donation will be directly deducted from your task payment.",0,0,0,0,0,0,0,1
 It's such a good cause.,0,1,0,0,0,0,0,0
" Hello, welcome .",0,0,0,0,0,0,0,1
Fine. ,0,0,0,0,0,0,0,1
Have you know about any children charity?,1,0,0,0,0,0,0,0
What do you think about these charity?,1,0,0,0,0,0,0,0
I also a member of an  children charity.,1,0,0,0,0,0,0,0
No.,0,0,0,0,0,0,0,1
USA is my country.In Iowa state.,1,0,0,0,0,0,0,0
Good evening! ,0,0,0,0,0,0,0,1
 How are you doing?,0,0,0,0,0,0,0,1
Great! ,0,0,0,0,0,0,0,1
I am working on an awesome project and I am in need of some help!,1,0,0,0,0,0,0,0
We're in need of donations in any amount.,0,1,0,0,0,0,0,0
Millions of Syrian children have grown up facing the daily threat of violence. ,0,0,1,0,0,0,0,0
I would really like for you to say yes to donating part of what you will be earning today. ,0,1,0,0,0,0,0,0
It's awesome to see the smiles on their faces!,0,0,1,0,0,0,0,0
 I wonder why this chat won't end,0,0,0,0,0,0,0,1
Yeah.  ,0,0,0,0,0,0,0,1
"Good evening, I would hope you are well. ",0,0,0,0,0,0,0,1
I am not but I truly think this organization is well worth donating to. ,0,1,0,0,0,0,0,0
Are you willing to donate to Save the Children?,0,1,0,0,0,0,0,0
"Can I ask if you spend money on candy, snacks of stuff like that? ",1,0,0,0,0,0,0,0
50 cents is better than nothing.,0,0,0,1,0,0,0,0
"In the first two months of this year over 1,000 children were injured or killed in Syria. ",0,0,1,0,0,0,0,0
" Hi, how are you?",0,0,0,0,0,0,0,1
"Good, thank you! ",0,0,0,0,0,0,0,1
I just wanted to tell you a little bit about a charity called Save the Children. ,1,0,0,0,0,0,0,0
It's a great organization. ,0,1,0,0,0,0,0,0
"Yes, and this one is very reputable. ",0,0,0,0,1,0,0,0
"Donations from ordinary people, just like you. ",0,0,0,0,0,1,0,0
Would you consider making a small donation today?,0,1,0,0,0,0,0,0
"No, your donation will be directly deducted from your task payment.",0,0,0,0,0,0,0,1
Great! The research team will collect all donations and send it to Save the Children!,0,0,0,0,0,0,0,1
Hi! How are you today?,0,0,0,0,0,0,0,1
: I am doing alright!,0,0,0,0,0,0,0,1
"I would like to talk to you about a charity, do you donate at all?",1,0,0,0,0,0,0,0
Have you heard of Save the Children?,1,0,0,0,0,0,0,0
 I encourage you to donate some or all of your bonus today to help save these children,0,1,0,0,0,0,0,0
Good morning! How are you today?,0,0,0,0,0,0,0,1
I am helping Save the Children raise money for their causes. ,1,0,0,0,0,0,0,0
Do you know about that charity?,1,0,0,0,0,0,0,0
"Well today, we are asking MTurk workers to donate a portion or all of their earnings connected with this HIT to Save the CHildren. ",1,0,0,0,0,0,0,0
That is great and thank you for your past support! ,1,0,0,0,0,0,0,0
You could do a lot of good with the additional donation today.,0,0,1,0,0,0,0,0
Think of it as giving up a cup of coffee today.,0,0,0,1,0,0,0,0
" I am not sure where you live, but I am in New York and you would be hard pressed to get a cup of coffee for $2.",1,0,0,0,0,0,0,0
That money could really be used to help children in terrible situations and make their lives slightly better.,0,0,1,0,0,0,0,0
"Not only that, but think about it in the bigger picture. ",0,0,0,1,0,0,0,0
Would you reconsider your earlier decision?,0,1,0,0,0,0,0,0
Well I can understand your position even though I think it is selfish. ,0,0,1,0,0,0,0,0
Good evening. ,0,0,0,0,0,0,0,1
I think their international focus is really persuasive.,0,1,0,0,0,0,0,0
I actually have only recently learned of them. ,1,0,0,0,0,0,0,0
Do you plan to continue supporting them?,1,0,0,0,0,0,0,0
Did you know that this chat is an opportunity to make a donation?,1,0,0,0,0,0,0,0
What did you like about their commercials?,1,0,0,0,0,0,0,0
How much of your $2 do you plan to donate?,0,1,0,0,0,0,0,0
It's really somebody else's money.,0,0,0,1,0,0,0,0
Your choice of course!,1,0,0,0,0,0,0,0
"Hi, how do you feel about the charity Save the Children",1,0,0,0,0,0,0,0
"Through the power of child sponsorship, you can help a child in need realize her dreams ¡ª transforming her life and the future we all share. ",0,0,1,0,0,0,0,0
"You can make sure they grow up healthy, educated and safe",0,0,1,0,0,0,0,0
"no not at all, Emergency Alert Right now, Save the Children remains gravely concerned about the well-being of children in the custody of the U.S. government after crossing our southern border.",1,0,0,0,0,0,0,0
"Children may only be 20% of our population, but they are 100% of our future. ",0,0,0,1,0,0,0,0
"All across the globe, children are dying from preventable causes, missing out on education due to poverty or gender, suffering from violence, exploitation and neglect, and are vulnerable in times of crisis. ",0,0,1,0,0,0,0,0
 Have you ever heard of Save the Children?,1,0,0,0,0,0,0,0
You can also make a .50 cent donation through me from your compensation of this hit. ,0,1,0,0,0,0,0,0
"I have made donations in the past, yes. ",1,0,0,0,0,0,0,0
So you'd like to donate?!,0,1,0,0,0,0,0,0
Have you ever heard of Save the Children?,1,0,0,0,0,0,0,0
Would you be interested in donating to this charity?,0,1,0,0,0,0,0,0
Don't you want to help stop that?,0,0,1,0,0,0,0,0
It is an international company.,0,0,0,0,1,0,0,0
That isn't a lot for a CEO.,0,0,0,1,0,0,0,0
hi. good evening,0,0,0,0,0,0,0,1
"great, thank you! do you have a moment to talk?",1,0,0,0,0,0,0,0
would you like more info on it or may I be abrupt and ask if you'd like to donate any of your task payment to the charity tonight? ,0,1,0,0,0,0,0,0
 I imagine $2 can help many children,0,0,1,0,0,0,0,0
that really puts things into perspective. ,1,0,0,0,0,0,0,0
"Cool, are you into giving to charities?",1,0,0,0,0,0,0,0
Have you ever heard of Save the Children?,1,0,0,0,0,0,0,0
 Would you like to make a tiny donation today?,0,1,0,0,0,0,0,0
Do you like to help good causes?,1,0,0,0,0,0,0,0
Yes and I found a really good one.,0,1,0,0,0,0,0,0
Have you heard of them?,1,0,0,0,0,0,0,0
Is that doable?,0,1,0,0,0,0,0,0
But would you like to double that to fifty cents?,0,1,0,0,0,0,0,0
I will take your donation of fifty cents and give to them.,0,1,0,0,0,0,0,0
It wants me to donate to Save the Children.,1,0,0,0,0,0,0,0
"The world can be a scary dangerous place, especially for children who are the most vunrable among us.  ",0,0,1,0,0,0,0,0
Taking care of children means going into places ravaged by war like Syria or places suffering from famine.,0,0,0,1,0,0,0,0
I'm glad you agree.  ,1,0,0,0,0,0,0,0
That's why I would like to speak with you about helping doing your part in helping hurting children by supporting Save the Children's global charity.,1,0,0,0,0,0,0,0
hi,0,0,0,0,0,0,0,1
how are you?,0,0,0,0,0,0,0,1
wow!,0,0,0,0,0,0,0,1
really/ ,0,0,0,0,0,0,0,1
woww!,0,0,0,0,0,0,0,1
which place?,0,0,0,0,0,0,0,1
oh!,0,0,0,0,0,0,0,1
"Hello, I would like to speak to you about Save The Children . ",1,0,0,0,0,0,0,0
Have you heard of this charity?,1,0,0,0,0,0,0,0
 You should feel proud of the decision you have made today. ,0,0,1,0,0,0,0,0
Could I ask for your help with something?,1,0,0,0,0,0,0,0
I am trying to get donations for Save the Children from people who complete this task.  ,1,0,0,0,0,0,0,0
Is that something you would consider?,0,1,0,0,0,0,0,0
"For instance, millions of Syrian children have grown up facing the daily threat of violence. ",0,0,1,0,0,0,0,0
"Wow, that is great!",1,0,0,0,0,0,0,0
 How much would you like to donate?,0,1,0,0,0,0,0,0
 Every amount is valuable and cents add up to dollars. ,0,0,0,1,0,0,0,0
"I do need a firm commitment though, I can't take probably.   ",0,1,0,0,0,0,0,0
Are you familiar with Save the Children?,1,0,0,0,0,0,0,0
Will you consider a donation?,0,1,0,0,0,0,0,0
 Please donate your fee to this important charity or at least part of it. ,0,1,0,0,0,0,0,0
What amount of your task fee would you like to donate today?,0,1,0,0,0,0,0,0
Please say yes to their most basic needs. ,0,1,0,0,0,0,0,0
That is how much our help is needed. ,0,0,1,0,0,0,0,0
 I know it will help alot,0,0,1,0,0,0,0,0
 U will be alright god be bless all of yall,1,0,0,0,0,0,0,0
That's also great,1,0,0,0,0,0,0,0
"I am doing well, just trying to talk to see if you would like to donate to Save the Children. ",1,0,0,0,0,0,0,0
" I went through the public education system, it was one of the better school districts at the time. ",1,0,0,0,0,0,0,0
What about you? ,1,0,0,0,0,0,0,0
Isn't that something you would like to help other children receive? ,0,0,1,0,0,0,0,0
You can just skip that next impulse purchase to help out. ,0,0,0,1,0,0,0,0
Many kids do not have access to safe living conditions to even make it to school each day. ,0,0,1,0,0,0,0,0
 Would you donate for that charity?,0,1,0,0,0,0,0,0
HOw much will you like to donate?,0,1,0,0,0,0,0,0
this is the life helping people and give the gift for the people,0,0,1,0,0,0,0,0
I think you should too.,0,1,0,0,0,0,0,0
How much do you think you will give right now since it can be directly deducted from the payment for this task.,0,1,0,0,0,0,0,0
On behalf of this hit i wat to talk to you about a charity,1,0,0,0,0,0,0,0
 I want to talk to you about a charity called Save the Children,1,0,0,0,0,0,0,0
HaHaHa ok so how much do you want to donate,0,1,0,0,0,0,0,0
do you like to donate money in save the children concept?,1,0,0,0,0,0,0,0
how much do you want to donate?,0,1,0,0,0,0,0,0
so what do you think to donate?,0,1,0,0,0,0,0,0
 can you please let me know the amount?,0,1,0,0,0,0,0,0
 approx how much?,0,1,0,0,0,0,0,0
Can I inquire as to why the charity section of your heart id potentially hardened?,1,0,0,0,0,0,0,0
What do you believe the value of charity is to you? ,1,0,0,0,0,0,0,0
"You see, in my opinion, Charity in and of itself is a selfish act. ",0,1,0,0,0,0,0,0
" Perhaps, but does the definition matter to those who are in need? ",0,0,0,1,0,0,0,0
"Well, I have one in mind specifically. It's called Save The Children. ",1,0,0,0,0,0,0,0
They seem pretty fantastic. ,0,1,0,0,0,0,0,0
Do you think you are ready to do that? ,0,1,0,0,0,0,0,0
 I think thats very admirable of you. ,1,0,0,0,0,0,0,0
It's pleasure talking with you today.,1,0,0,0,0,0,0,0
would you donate .15 cents? ,0,1,0,0,0,0,0,0
"Recently for instance, millions of Syrian children have grown up facing the daily threat of violence. ",0,0,1,0,0,0,0,0
okay.... i think this is about children's charity,1,0,0,0,0,0,0,0
would you like to donate something,0,1,0,0,0,0,0,0
Would you like to donate. ,0,1,0,0,0,0,0,0
About 1 dollar per day. ,1,0,0,0,0,0,0,0
Are you familiar with a charity called Save the Children?,1,0,0,0,0,0,0,0
That's great! The monies will go to a worthy cause. ,0,0,1,0,0,0,0,0
 Any chance you would consider making a greater donation?  ,0,1,0,0,0,0,0,0
"Yes, I have been asked to solicit a donation to the Save the Children charity.",1,0,0,0,0,0,0,0
t's been around almost forever.  ,0,0,0,0,1,0,0,0
Kids are so in need. ,0,0,1,0,0,0,0,0
 Don't you want to help them.,0,0,1,0,0,0,0,0
doctors without borders is my fave...my best friend's parents used to work for them,1,0,0,0,0,0,0,0
 i come up with an amount 500,0,1,0,0,0,0,0,0
yes i'm also think so. ,0,0,0,1,0,0,0,0
"For instance, millions of Syrian children have grown up facing the daily threat of violence. ",0,0,1,0,0,0,0,0
That is amazing :) ,1,0,0,0,0,0,0,0
I believe if we are able to give people a proper education they can learn so much and see that anything is possible in our world. ,0,1,0,0,0,0,0,0
That the world is not always cruel and that you can pull yourself from the ground up to the sky if you really want to.,0,0,1,0,0,0,0,0
If we do not help our children then there will be no future. ,0,0,0,1,0,0,0,0
So based off our discussion would you be interested in donating to the charity now? ,0,1,0,0,0,0,0,0
Do you have a figure in mind?,0,1,0,0,0,0,0,0
"Your donation means the world, and is very generous of you.",1,0,0,0,0,0,0,0
"Yes, Hope you aware whats going with child who died from hunger ",0,0,1,0,0,0,0,0
You are such a good personality .. ,1,0,0,0,0,0,0,0
How much do you like to donate to the charity now? ,0,1,0,0,0,0,0,0
Do you donate to charities at all?,1,0,0,0,0,0,0,0
Would you be interested in donating to Save the Children. ,0,1,0,0,0,0,0,0
I am so grateful that your cousin got the medical care they needed. ,1,0,0,0,0,0,0,0
 I do feel for your family and that terrible disease of cancer. ,1,0,0,0,0,0,0,0
I recently lost my sister-in-law to breast cancer but I've never been through it with my children.,1,0,0,0,0,0,0,0
It can break your heart,1,0,0,0,0,0,0,0
"Yes, St Jude is one I donate to also. ",1,0,0,0,0,0,0,0
Is there a chance you would make a donation to Save the Children today?,0,1,0,0,0,0,0,0
" It can be a small amount such as ten cents, up to $2. ",0,1,0,0,0,0,0,0
Thank you for sharing your personal information with me. ,1,0,0,0,0,0,0,0
Me too. ,1,0,0,0,0,0,0,0
I promise you I'm donating per your request. ,0,1,0,0,0,0,0,0
Save the Children is a great charity you should consider donating to,0,1,0,0,0,0,0,0
I think that's great too but if you already give to St Jude why not give to Save the Children this time?,0,0,0,1,0,0,0,0
"Honestly, if you think you're broke you should see how poor these children are. ",0,0,1,0,0,0,0,0
"You know they're worse off than you, right?",0,0,1,0,0,0,0,0
Couldn't you split it 50/50?,0,1,0,0,0,0,0,0
 Give them $1?,0,1,0,0,0,0,0,0
I mean you'd give that to St Jude wouldn't you?,0,0,0,1,0,0,0,0
This isn\'t money you\'ve even seen yet though.,0,0,0,1,0,0,0,0
"It\'s ""imaginary"" money until it materializes so that\'s different? ",0,0,0,1,0,0,0,0
Well think of all the money you spend on things you don't need? ,0,0,1,0,0,0,0,0
They have even less than your daughter has. ,0,0,1,0,0,0,0,0
You can surely spare $2,0,1,0,0,0,0,0,0
How much do you like to donate to the charity now? ,0,1,0,0,0,0,0,0
"I'm drinking ginger ale, with maximum amount of ice cubes my glass can hold, lol",1,0,0,0,0,0,0,0
"yeah you can get some great ginger ale's from whole foods etc, which are made with stevia and wot not, I don't drink traditional sodas myself, anyway, if I may digress. ",1,0,0,0,0,0,0,0
Have you heard of an organization called Save the Children?,1,0,0,0,0,0,0,0
Great that is very generous of you. ,1,0,0,0,0,0,0,0
Have you heard of Save the Children charity?,1,0,0,0,0,0,0,0
I did years ago. ,1,0,0,0,0,0,0,0
Now I contribute to my local cat rescue group and we have a shelter dog group too.,1,0,0,0,0,0,0,0
"As you can probably tell, I love animals",1,0,0,0,0,0,0,0
With a group of folks just giving that much would add up.  ,0,0,0,1,0,0,0,0
And such a small amount probably wouldn't hurt the pocketbook too badly.,0,0,0,1,0,0,0,0
 That warm fuzzy feeling. Lol,0,0,1,0,0,0,0,0
Lol,0,0,1,0,0,0,0,0
"Yes, I have Dude, he is a black lab, I have Popeye who is a little corgi mix.  ",1,0,0,0,0,0,0,0
They are the best dogs I have ever had. ,1,0,0,0,0,0,0,0
Do you have pets?,1,0,0,0,0,0,0,0
Your donation will do a lot to help kids,0,0,1,0,0,0,0,0
You are helping yourself first by donating. ,0,1,0,0,0,0,0,0
A simple internet search will show you what they have done. ,1,0,0,0,0,0,0,0
They need your donation,0,1,0,0,0,0,0,0
" It looks like this chat is supposed to be to learn more about ""Save the Children"".  ",1,0,0,0,0,0,0,0
Have you ever heard of it?,1,0,0,0,0,0,0,0
It seems vaguely familiar but I never paid attention specifically.  ,1,0,0,0,0,0,0,0
Have you ever donated to them?,1,0,0,0,0,0,0,0
"From what I'm reading, it sounds like a great cause",0,1,0,0,0,0,0,0
I can't imagine what that's like for the parents. ,0,0,1,0,0,0,0,0
How often do you donate to things like this?  ,1,0,0,0,0,0,0,0
"I usually give to animal charities like the local no-kill shelter, but it's always interesting to learn about new places to make an impact. ",1,0,0,0,0,0,0,0
" Do you feel that you donate more in terms of money, or in terms of volunteering your time?",1,0,0,0,0,0,0,0
I'm usually pretty busy so try to donate a little here and there. ,1,0,0,0,0,0,0,0
Do you ever donate to charity?,1,0,0,0,0,0,0,0
Have you ever volunteered? ,1,0,0,0,0,0,0,0
 Time and money these days can be scarce!,0,0,0,1,0,0,0,0
And think of all the kiddies you will be helping!,0,0,1,0,0,0,0,0
do you think you will donate today?,0,1,0,0,0,0,0,0
"oh, could you afford maybe fifteen cents?",0,1,0,0,0,0,0,0
"well, I'll match your 5.00, does that sound cool?",0,1,0,0,0,0,0,0
"yes I like to give to doctors without borders, they risk their lives to go where they are most needed",1,0,0,0,0,0,0,0
there are so many wars and so many natural disasters,0,0,1,0,0,0,0,0
What type of donation would you be most interested in?,1,0,0,0,0,0,0,0
Ok that is amazing news.,1,0,0,0,0,0,0,0
 If you have any family that would be interested in donating please direct them to our page. ,0,1,0,0,0,0,0,0
And we are always looking for people to help! ,1,0,0,0,0,0,0,0
"Nope! You are all set, you can donate here https://support. URL ite/Donation2?df_id=1620&1620.donation=form1 or I can simply ask you to donate through the task payment if that is something that interests you? ",0,1,0,0,0,0,0,0
Have you ever heard of them?,1,0,0,0,0,0,0,0
"yes, have you heard about the crisis in syria?",1,0,0,0,0,0,0,0
Given the chance would you be willing to donate some of your task payment to organizations like save the children? ,0,1,0,0,0,0,0,0
"choosing anywhere between $0 and all of your payment, how much would you like to donate?",0,1,0,0,0,0,0,0
Do you think you can donate a bit more?,0,1,0,0,0,0,0,0
"I understand but these are children, it would help them out very much. ",0,0,1,0,0,0,0,0
Every dollar counts.,0,0,0,1,0,0,0,0
 I'm really glad you decided to donate.,1,0,0,0,0,0,0,0
What part of the world are you in?,1,0,0,0,0,0,0,0
"Oh wow, I used to live in Jersey City, which is a ride away from NYC.",1,0,0,0,0,0,0,0
So cool.,1,0,0,0,0,0,0,0
"I went to school there from nonprofit management, and ironically I'm working with a group called Save The Children. ",1,0,0,0,0,0,0,0
Ones we often take for granted in the states. ,0,0,1,0,0,0,0,0
Are you interested in giving back a bit of $$?,0,1,0,0,0,0,0,0
" It could do so much good in the life of a hungry, neglected, or abused child. ",0,0,1,0,0,0,0,0
Oh wow. Do you have a boy or a girl?,1,0,0,0,0,0,0,0
I totally understand your position. ,0,0,0,1,0,0,0,0
"Again, no amount is too small. ",0,0,0,1,0,0,0,0
One penny donated from your earnings could do a lot of good in the 3rd world. ,0,0,0,1,0,0,0,0
I'll match whatever you decide to give.,0,1,0,0,0,0,0,0
Let me know.,0,1,0,0,0,0,0,0
Well total congrats to you on new mother! ,1,0,0,0,0,0,0,0
And thank you so much for your donation!,1,0,0,0,0,0,0,0
I will of course match that $.25. ,0,1,0,0,0,0,0,0
Is the father of your child expected to recover soon and be released. ,1,0,0,0,0,0,0,0
That is so terrible. ,1,0,0,0,0,0,0,0
"For anyone, but especially a new dad. ",1,0,0,0,0,0,0,0
You totally have my prayers and positive energy.,1,0,0,0,0,0,0,0
 Oh wow so cool. ,1,0,0,0,0,0,0,0
"I know funds are low, but in the future are there any causes you feel strongly about that you would put your money behind?",1,0,0,0,0,0,0,0
Oh. Recently I've become interested in donating to people who are wrongfully incarcerated. ,1,0,0,0,0,0,0,0
 I'd like to donate to their legal fees. ,1,0,0,0,0,0,0,0
I am glad you are joining me here for this important task.,1,0,0,0,0,0,0,0
Oh that is good!,1,0,0,0,0,0,0,0
I also have children.,1,0,0,0,0,0,0,0
I have three girls. ,1,0,0,0,0,0,0,0
You? (I won't ask for any personal details - I promise.),1,0,0,0,0,0,0,0
You?,1,0,0,0,0,0,0,0
"My oldest will be 21 next week, and the youngers ones are in their late teenage years. ",1,0,0,0,0,0,0,0
My husband has a little brother who has Asperger's. ,1,0,0,0,0,0,0,0
"Not nearly the level of autism of your son, but I do have empathy for you. ",1,0,0,0,0,0,0,0
Do you think that it's because she has spent her life watching (and I'd assume participating in the) care of her brother?,1,0,0,0,0,0,0,0
Wow! You must be very proud of her! ,1,0,0,0,0,0,0,0
"My other girls, though, have no idea what they like, except that they all like taking care of children (all work in day care or nanny jobs).",1,0,0,0,0,0,0,0
 I am with you there! ,1,0,0,0,0,0,0,0
I have absolutely zero flair for style.,1,0,0,0,0,0,0,0
 It does make me feel good to see that. ,1,0,0,0,0,0,0,0
"I feel like I must have done some good things right as a mom, if they like kids so much!",1,0,0,0,0,0,0,0
I am sure you have done a great job with both of your kids! ,1,0,0,0,0,0,0,0
It sounds like they are very special!,1,0,0,0,0,0,0,0
"I didn't design it this way, but I am glad that we talked about our kids so much. ",1,0,0,0,0,0,0,0
Are you familiar with a charity called Save the Children? ,1,0,0,0,0,0,0,0
 I am to ask you if you would please donate all or part of the small stipend that we make for this discussion to that charity tonight. ,0,1,0,0,0,0,0,0
Would you do that?,0,1,0,0,0,0,0,0
"Yes, as do I. ",1,0,0,0,0,0,0,0
I am grateful that there are people like you out there. ,1,0,0,0,0,0,0,0
I am also very happy that your daughter will be in the nursing profession.,1,0,0,0,0,0,0,0
It sounds like she comes from a good family!,1,0,0,0,0,0,0,0
Yes many people donate for this noble cause. ,0,0,0,0,0,1,0,0
 We have several campaigns.,1,0,0,0,0,0,0,0
Like Educate a Girl.,1,0,0,0,0,0,0,0
Thank you. You have made a great decision. ,1,0,0,0,0,0,0,0
Thank you.,1,0,0,0,0,0,0,0
" Hello, how's your day going?",0,0,0,0,0,0,0,1
"Good so far, been busy with HITs this morning which is a nice change for the usual weekend lull of HITs",1,0,0,0,0,0,0,0
"Yea the weather is looking up today, might have to get out to a park or something fun today.",1,0,0,0,0,0,0,0
"I have a few times, through this HIT actually. ",1,0,0,0,0,0,0,0
At the end the researchers let us donate any amount of our task payment directly to the organization.,1,0,0,0,0,0,0,0
I'm going to donate $.30 - today has been a good day for HITs so it won't kill me heh.,1,0,0,0,0,0,0,0
" It'd be cool if they showed us at the end of the study how much has been raised so far, I'd really like that.",1,0,0,0,0,0,0,0
hello,0,0,0,0,0,0,0,1
we are about making a donation to a fund named save the children,1,0,0,0,0,0,0,0
how much would be appropriate for you?,0,1,0,0,0,0,0,0
do you know what save the children fund does? ,1,0,0,0,0,0,0,0
how often do you donate?,1,0,0,0,0,0,0,0
do you volunteer too?,1,0,0,0,0,0,0,0
