text,1-RAPPORT,2-NEGOTIATE,3-EMOTION,4-LOGIC,5-AUTHORITY,6-SOCIAL,7-PRESSURE,8-NO-PERSUASION
Do you think this is something you could see yourself donating to?,0,1,0,0,0,0,0,0
"If the donation was to come out of your current earnings for this task, how much would you be willing to donate?",0,1,0,0,0,0,0,0
I'm so sorry to hear about your cat.,1,0,0,0,0,0,0,0
"I completely understand, I'm having a root canal done today, that will put me back at least $1100.",1,0,0,0,0,0,0,0
"In an ideal world, where we had all the monies, how much would you be willing to donate to a cause like this?",0,1,0,0,0,0,0,0
Yep.,0,0,0,0,0,0,0,1
Do you happen to be a parent?,1,0,0,0,0,0,0,0
How are they relevant to you?,1,0,0,0,0,0,0,0
We definitely need more people like you in the world.,1,0,0,0,0,0,0,0
Have you heard of the separation of kids from their parents at the Mexico-US border lately?,0,0,1,0,0,0,0,0
Yea.,0,0,0,0,0,0,0,1
Would you like to help by donating?,0,1,0,0,0,0,0,0
Even a couple of cents.,0,1,0,0,0,0,0,0
Whatever you can afford.,0,1,0,0,0,0,0,0
Hello.,0,0,0,0,0,0,0,1
I am just now watching the news about the hurricane in Hawaii and seeing the damage already done.,0,0,1,0,0,0,0,0
I know.,0,0,0,0,0,0,0,1
I actually have family living there.,1,0,0,0,0,0,0,0
Definitely more in need of monetary donations.,0,1,0,0,0,0,0,0
They are asking people to donate to their emergency fund.,0,1,0,0,0,0,0,0
"If you are willing, you can actually donate from your payment from this hit!",0,1,0,0,0,0,0,0
How nice of you.,1,0,0,0,0,0,0,0
"Yes, I can give you that information, but would you like to start with donating part or all of your payment for this hit?",0,1,0,0,0,0,0,0
Wow!,0,0,0,0,0,0,0,1
That is very generous.,1,0,0,0,0,0,0,0
"I am still thinking, though, that the small donations made from these hits are so easy to donate and can really add up if we all pitch in together!",0,1,0,0,0,0,0,0
You can even just give a very small portion of your compensation from this hit.,0,1,0,0,0,0,0,0
I was wanting to see if you would be willing to donate to a charity called Save the Children.,0,1,0,0,0,0,0,0
So many children die every day due to starvation and acts of violence in these developing countries.,0,0,1,0,0,0,0,0
These children are not given the same opportunity at education as you and I.,0,0,1,0,0,0,0,0
Think about the unnecessary money that you spend on small things everyday like a snack or bag of candy.,0,0,1,0,0,0,0,0
Most of these children will never know what it is like to go into a store and purchase something of such luxury.,0,0,1,0,0,0,0,0
Your donation will be directly deducted from your task payment.,0,1,0,0,0,0,0,1
You can choose any amount from $0 to all your payment.,0,1,0,0,0,0,0,1
It is your choice what you would like to donate so if you want to do .30 you can.,0,1,0,0,0,0,0,0
How much would you like to donate to the charity?,0,1,0,0,0,0,0,0
Hey!,0,0,0,0,0,0,0,1
Are you a parent?,1,0,0,0,0,0,0,0
Same.,1,0,0,0,0,0,0,0
I have 2 kids as well.,1,0,0,0,0,0,0,0
"Just started back to school today, in fact!",1,0,0,0,0,0,0,0
I know!,0,0,0,0,0,0,0,1
I'm from Pennsylvania.,1,0,0,0,0,0,0,0
How old are your children?,1,0,0,0,0,0,0,0
Haha!,0,0,0,0,0,0,0,1
I have a 13 year old who acts 2 and a 6 year old who just turned 6 yesterday!,1,0,0,0,0,0,0,0
Those are such fun ages!,1,0,0,0,0,0,0,0
I wish I could help every child.,0,0,1,0,0,0,0,0
They're a pretty solid organization.,0,0,0,0,1,0,0,0
"In fact, would you consider donating some or all of your payment for this task to them?",0,1,0,0,0,0,0,0
"Save the Children is an international non-governmental organization that promotes children's rights, provides relief and helps support children in developing countries.",0,0,0,0,1,0,0,0
They have been the world leader in  it for over 100 years.,0,0,0,0,1,0,0,0
Especially seeing as how millions of Syrian children have grown up facing the daily threat of violence.,0,0,1,0,0,0,0,0
"In the first two months of 2018 alone, 1,000 children were reportedly killed or injured in intensifying violence",0,0,1,0,0,0,0,0
hi!,0,0,0,0,0,0,0,1
Would you consider donating?,0,1,0,0,0,0,0,0
I would like to donate a couple cents,1,0,0,0,0,0,0,0
"No rules, you just give what you can. ",0,1,0,0,0,0,0,0
"hat is great to hear, but you can donate a few cents today.",0,1,0,0,0,0,0,0
How much would you like to donate?,0,1,0,0,0,0,0,0
Hello!,0,0,0,0,0,0,0,1
Is that something that you would be interested in?,0,1,0,0,0,0,0,0
How much would you like to donate to the charity?,0,1,0,0,0,0,0,0
"The donation will be directly deducted from your task payment, and you can choose any amount up to the full payment of $2?",0,1,0,0,0,0,0,0
this would just be donating part of the payment you would be receiving for this task!,0,1,0,0,0,0,0,0
Always happy to help.,1,0,0,0,0,0,0,0
Are you sure you wouldn't like to donate a round number today?,0,1,0,0,0,0,0,0
The payment is upto $2.00 and donating $0.19 will give you an odd penny,0,1,0,0,0,0,0,0
So to confirm you would like to donate $0.19 from your payment today ?,0,1,0,0,0,0,0,0
ou can choose any amount from $0 to all your payment ($2).,0,1,0,0,0,0,0,0
thank you,0,0,0,0,0,0,0,1
Our children are our future.,0,0,0,1,0,0,0,0
We have to look out for them.,0,0,0,1,0,0,0,0
"Did you know that In 2017 alone, Save the Children reached more than 155 million children in 120 countries, including the U.S.?",0,0,0,0,1,0,0,0
You sound like a very generous and caring person!,1,0,0,0,0,0,0,0
You can donate some of your money from the task payment.,0,1,0,0,0,0,0,0
You can choose any amount from 0 to all your payment of 2 dollars.,0,1,0,0,0,0,0,0
Any little bit would help.,0,1,0,0,0,0,0,0
"Could you donate a little bit more, say 25 cents?",0,1,0,0,0,0,0,0
Hello.,0,0,0,0,0,0,0,1
How much would you like to donate?,0,1,0,0,0,0,0,0
Are you sure you would not like to donate more?,0,1,0,0,0,0,0,0
Would you rather not round it up to a dollar instead?,0,1,0,0,0,0,0,0
I see.,0,0,0,0,0,0,0,1
Very well.,0,0,0,0,0,0,0,1
These poor suffering children!,0,0,1,0,0,0,0,0
Did you know that 5.6 million children die each year due to treatable AND preventable diseases?,0,0,1,0,0,0,0,0
"And yes, it could seem like the aid is a drop in a bucket.",0,0,0,1,0,0,0,0
What's really fascinating is that you can actually directly contribute your reward for this task directly to that charity.,0,1,0,0,0,0,0,0
Incredible!,1,0,0,0,0,0,0,0
How much do you like to donate to the charity now?,0,1,0,0,0,0,0,0
Your donation will be directly deducted from your task payment.,0,1,0,0,0,0,0,1
You can choose any amount from $0 to all your payment.,0,1,0,0,0,0,0,1
"But oh buddy, think about what you would gain?",0,1,0,0,0,0,0,0
Thanks for having an open mind and doing what's right.,1,0,0,0,0,0,0,0
I wish more people would.,0,0,0,0,0,1,0,0
A lot of organizations seem to have issues with overhead.,0,0,0,1,0,0,0,0
"In just one area, Syria, millions of Syrian children have grown up facing the daily threat of violence.",0,0,1,0,0,0,0,0
"n the first two months of 2018 alone, 1,000 children were reportedly killed or injured!",0,0,1,0,0,0,0,0
That is true.,0,0,0,1,0,0,0,0
This one seems to have been around for awhile and seems to be highly rated though.,0,0,0,0,1,0,0,0
"Yeah, I have donated little amounts here and there as I can.",1,0,0,0,0,0,0,0
I give little bits when I can.,1,0,0,0,0,0,0,0
Would you be interested in giving a small donation??,0,1,0,0,0,0,0,0
You can choose any amount from $0 to all your payment ($2).,0,1,0,0,0,0,0,0
Wow!,0,0,0,0,0,0,0,1
That is amazing!,1,0,0,0,0,0,0,0
"oh good, i have donate 100$ , i love the children",1,0,0,0,0,0,0,0
I am in hopes you will share your earning as I have to a charity close to me heart called Save the Children.,0,1,0,0,0,0,0,0
URL ,0,0,0,0,0,0,0,1
It is a great thing for children!,0,0,0,1,0,0,0,0
Each donation will go to a trust-able fund for the children which makes me trust and know my donation is going to the right place and for the right reason.,0,0,0,0,1,0,0,0
Exactly my thoughts!!,1,0,0,0,0,0,0,0
"I am going to donate my payment from this task, how much do you think you would be willing to donate from this task?",0,1,0,0,0,0,0,0
That is truly awesome!!,1,0,0,0,0,0,0,0
hi,0,0,0,0,0,0,0,1
I would donate around 0.50 cents.,0,1,0,0,0,0,0,0
How much would you donate?,0,1,0,0,0,0,0,0
Hello.,0,0,0,0,0,0,0,1
Sure.,0,0,0,0,0,0,0,1
"You can choose any amount, from nothing to your full compensation.",0,1,0,0,0,0,0,0
How much do you think you'd like to donate to the charity?,0,1,0,0,0,0,0,0
"That's wonderful, thank you so much!",1,0,0,0,0,0,0,0
"i am not, just working from home on my only day off.",1,0,0,0,0,0,0,0
"i think it would be great, even you donated just a dollar you would be helping out two different families.",0,1,0,0,0,0,0,0
You donation will be directly deducted from your task payment.,0,0,0,0,0,0,0,1
Where are you from?,1,0,0,0,0,0,0,0
I'm in New York,1,0,0,0,0,0,0,0
Small world eh?,1,0,0,0,0,0,0,0
The humidity has been kind of brutal here the last couple of days.,1,0,0,0,0,0,0,0
So I was wondering?,0,0,0,0,0,0,0,1
Would you be willing to donate a portion of your task money to SAVE THE CHILDREN?,0,1,0,0,0,0,0,0
"ensuring children's rights t health, education and safety?",0,0,1,0,0,0,0,0
"that is correct, so how much of your task money would you like to donate, right now?",0,1,0,0,0,0,0,0
hi,0,0,0,0,0,0,0,1
"ok, are you donate any children's charity?",0,1,0,0,0,0,0,0
How much did you donate children's charity?,0,1,0,0,0,0,0,0
Oh!,0,0,0,0,0,0,0,1
I like to donate $10.,1,0,0,0,0,0,0,0
Thank you very much to chat with me.,1,0,0,0,0,0,0,0
Would you be interested in donating to Save the Children ?,0,1,0,0,0,0,0,0
some of these donations can address the problem of the daily threat of violence,0,0,1,0,0,0,0,0
How much would you like to donate ?,0,1,0,0,0,0,0,0
Your donation will be deducted from your task payment.,0,0,0,0,0,0,0,1
How much would that be ?,0,1,0,0,0,0,0,0
Thank you so much for taking the time to speak with me and also for your donation.,1,0,0,0,0,0,0,0
Take care and have a great day.,1,0,0,0,0,0,0,0
It was nice chatting with you.,1,0,0,0,0,0,0,0
Hello.,0,0,0,0,0,0,0,1
Do you have children?,1,0,0,0,0,0,0,0
Well they have a presence in every continent except Antarctica.,0,0,0,0,1,0,0,0
They are very renowned.,0,0,0,0,1,0,0,0
"Internationally, they are pioneers in health education and protection programs.",0,0,0,0,1,0,0,0
Charity is very important and everyone should have a fighting chance in life.,0,0,1,0,0,0,0,0
Is this an organization you would consider donating to?,0,1,0,0,0,0,0,0
I have in the past.,1,0,0,0,0,0,0,0
How much do you like to donate to the charity now?,0,1,0,0,0,0,0,0
Your donation will be directly deducted from your task payment.,0,1,0,0,0,0,0,1
You can choose any amount from $0 to all your payment.,0,1,0,0,0,0,0,1
"Millions of children around the world lack basic things like food, water, and shelter.",0,0,1,0,0,0,0,0
Your donation will be directly deducted from your task payment.,0,1,0,0,0,0,0,1
You can choose any amount from $0 to all your payment ($2).,0,1,0,0,0,0,0,1
"Sounds good, how much would you like to give?",0,1,0,0,0,0,0,0
Hello friend!,1,0,0,0,0,0,0,0
"In fact, you can sponsor an individual child from countries all around the world who does not have the sustenance to survive",0,0,1,0,0,0,0,0
That's incredible!,1,0,0,0,0,0,0,0
God bless them!,1,0,0,0,0,0,0,0
"I am not personally associated with Save the Children, I just wanted to promote their organization because I think it is very noble and a fantastic cause.",0,0,0,0,1,0,0,0
You hit it right on the head.,1,0,0,0,0,0,0,0
"Not saying that they\'re aren\'t real problems in our society, but like you said, they are miniscule compared to what could be.",0,0,1,0,0,0,0,0
"With that being said, would you consider donating a portion of your task donation to Save the Children?",0,1,0,0,0,0,0,0
"You can donate any amount of your payment ($0-$2), any bit helps",0,1,0,0,0,0,0,0
Thank you for listening!,1,0,0,0,0,0,0,0
"Thank you very much, both for your donation and your time.",1,0,0,0,0,0,0,0
I hope you have a fantastic day!,1,0,0,0,0,0,0,0
I feel the same.,1,0,0,0,0,0,0,0
It's been a long day.,1,0,0,0,0,0,0,0
"Well, there is a charity called Save The Children that is desperate for donations no matter how small to help children in war torn and third world countries.",0,0,1,0,0,0,0,0
I know what you mean but I'm willing to donate a little.,0,1,0,0,0,0,0,0
I would like to try to help someone else.,0,0,1,0,0,0,0,0
How much would you like to donate to the charity now?,0,1,0,0,0,0,0,0
Your donation will be directly deducted from your task payment.,0,0,0,0,0,0,0,1
You can choose any amount from $0 to all your payment which is $2.,0,1,0,0,0,0,0,0
"Thanks, have a nice day!",1,0,0,0,0,0,0,0
I'm willing to donate $1.,0,1,0,0,0,0,0,0
HI,0,0,0,0,0,0,0,1
ARE YOU INTRESTED TO DONATE SOME FUNDS TO CHARITY TO SAVE SOME CHILDRENS,0,1,0,0,0,0,0,0
"You are helping to small childrens for their studies,etc",0,0,1,0,0,0,0,0
I do United World wide or Food for the poor,1,0,0,0,0,0,0,0
yes it  is the most important one in life.,0,0,0,1,0,0,0,0
Yes in developing countries lack of educations for childrens in war zone and even if you taken in syria the millions of peoples meet their daily days by violance but we have a great days so we make that happier and healthier,0,0,1,0,0,0,0,0
How much do you like to donate to the charity now?,0,1,0,0,0,0,0,0
Your donation will be directly deducted from your task payment.,0,1,0,0,0,0,0,1
You can choose any amount from $0 to all your payment.,0,1,0,0,0,0,0,1
How much you can donate that.,0,1,0,0,0,0,0,0
You have a great soul.,1,0,0,0,0,0,0,0
hi,0,0,0,0,0,0,0,1
i am fine.,0,0,0,0,0,0,0,1
how about you?,0,0,0,0,0,0,0,1
Hi there!,0,0,0,0,0,0,0,1
How about yourself?,1,0,0,0,0,0,0,0
Both children in the US and in developing countries!,0,0,0,1,0,0,0,0
Have you thought about donating?,0,1,0,0,0,0,0,0
Even just $.50!,0,1,0,0,0,0,0,0
Money is something I think we can all relate to.,1,0,0,0,0,0,0,0
"I'm sorry to hear things are tight right now, too.",1,0,0,0,0,0,0,0
That can be extremely stressful.,1,0,0,0,0,0,0,0
It is called Save The Children.,0,0,0,0,0,0,0,1
They help on six continents.,0,0,0,0,1,0,0,0
We get people to think how our change that can buy a cup of coffee here could help a family eat for a day or more somewhere else.,0,0,1,0,0,0,0,0
"You can donate from $0 to $2, your payment?",0,1,0,0,0,0,0,0
So you would like to donate 50 cents?,0,1,0,0,0,0,0,0
Hello,0,0,0,0,0,0,0,1
I didn't read all instructions carefully lol.,1,0,0,0,0,0,0,0
Aw that's kinda cool.,1,0,0,0,0,0,0,0
How old are you??,1,0,0,0,0,0,0,0
I'm 28 years old.,1,0,0,0,0,0,0,0
Born and raised in Texas.,1,0,0,0,0,0,0,0
My boyfriend doesn't want to have children until he has his career secured.,1,0,0,0,0,0,0,0
Well I dont want to have children I prefer adopting one or two.,1,0,0,0,0,0,0,0
And he is okay with that decision.,1,0,0,0,0,0,0,0
So many expenses.,0,0,0,1,0,0,0,0
"Good thing we have different charities that help out children all over the world, for example, Save the Children.",0,0,0,1,0,0,0,0
I guess I have to ask you: How much do you like to donate to the charity now?,0,1,0,0,0,0,0,0
Your donation will be directly deducted from your task payment.,0,1,0,0,0,0,0,1
You can choose any amount from $0 to all your payment ($2).,0,1,0,0,0,0,0,1
Please consider donating a portion of your payment to the Save the Children charity,0,1,0,0,0,0,0,0
Yes it is!,0,0,0,1,0,0,0,0
Yes!,0,0,0,0,0,0,0,1
Great!,0,0,0,0,0,0,0,1
You can choose any amount from $0 to $2 to donate.,0,1,0,0,0,0,0,0
"Hi, I'm happy to start this chat with you and I am writing to appeal to you regarding donating some or all of your hit earned to Save the Children.",0,1,0,0,0,0,0,0
"It is literally one of the most trusted organizations in the world for assisting children of all nations to be fed, clothed, educated and safe.",0,0,0,0,1,0,0,0
Do you think you would be willing to donate your earnings from this hit to needy children?,0,1,0,0,0,0,0,0
What do you say?,0,1,0,0,0,0,0,0
Ok.,0,0,0,0,0,0,0,1
I know that the donations collected here go directly to the charity and it is a non-profit organization.,0,0,0,0,1,0,0,0
It's so far removed from how our lives are.,1,0,0,0,0,0,0,0
"So you are doing 50 cents, just to confirm?",0,1,0,0,0,0,0,0
How much do you like to donate to the charity now?,0,1,0,0,0,0,0,0
Your donation will be directly deducted from your task payment.,0,1,0,0,0,0,0,1
"You can choose any amount from $0 to all your payment.""",0,1,0,0,0,0,0,1
"Very good, thank you.",1,0,0,0,0,0,0,0
"Hello, how are you today? ",0,0,0,0,0,0,0,1
"Wow, that is awesome.",1,0,0,0,0,0,0,0
Thank you so much.,1,0,0,0,0,0,0,0
Thank you very much.,1,0,0,0,0,0,0,0
They are an amazing charity helping children all over the world including the ones right here in America,0,0,0,0,1,0,0,0
Did you know they have been around 100 years?,0,0,0,0,1,0,0,0
They are on the ground in 120 countries it is so amazing,0,0,0,0,1,0,0,0
Could you please donate all of your$2 to Save the Children?,0,1,0,0,0,0,0,0
Save the Children has been around since 1919 qng is top rated by Charity Watch.,0,0,0,0,1,0,0,0
What makes American children more needy?,0,0,0,1,0,0,0,0
"To be honest, not having a cell phone is hardly poverty.",0,0,0,1,0,0,0,0
American children are hardly in the situation that many African children are,0,0,0,1,0,0,0,0
Hope didn't go to Starbucks today and get a $4 coffee.,0,0,1,0,0,0,0,0
Now that's a corporate contribution.,0,0,1,0,0,0,0,0
"Ok, if $2 is too much, how about $1?",0,1,0,0,0,0,0,0
MTurk doesn't exactly pay subsistence wages.,0,0,0,1,0,0,0,0
I'm a retiree.,1,0,0,0,0,0,0,0
I hope you do too.,0,1,0,0,0,0,0,0
I appreciate it.,1,0,0,0,0,0,0,0
Hi!,0,0,0,0,0,0,0,1
How are you doing today?,0,0,0,0,0,0,0,1
 The research team will collect donations and send it to Save the Children. So we don't even need to use Paypal.,0,0,0,0,0,0,0,1
Hello.,0,0,0,0,0,0,0,1
Thanks!,0,0,0,0,0,0,0,1
Have you ever been to the Save the Children website?,0,0,0,0,0,0,0,1
URL,0,0,0,0,0,0,0,1
Ok great!,0,0,0,0,0,0,0,1
I am glad the Researchers are helping too!,0,0,0,0,0,0,0,1
"I'd love to chat with you more, but I have to run off --- my coffee is brewing and waiting for me to indulge.",0,0,0,0,0,0,0,1
Hi,0,0,0,0,0,0,0,1
I'm here to talk about the charity Save the Children.,0,0,0,0,0,0,0,1
The survey should continue at this point I think.,0,0,0,0,0,0,0,1
"Yeah that was what I was thinking, the base amount is very low.",0,0,0,0,0,0,0,1
I think it's waiting for 10 messages each so it should continue now.,0,0,0,0,0,0,0,1
Hi!,0,0,0,0,0,0,0,1
I'm pretty good.,0,0,0,0,0,0,0,1
Thanks.,0,0,0,0,0,0,0,1
It's called Save the Children.,0,0,0,0,0,0,0,1
Yes they do.,0,0,0,0,0,0,0,1
Yes it is.,0,0,0,0,0,0,0,1
Absolutely!,0,0,0,0,0,0,0,1
You'll get to confirm your donation on the next screen.,0,0,0,0,0,0,0,1
Thanks :),0,0,0,0,0,0,0,1
You too!,0,0,0,0,0,0,0,1
Ok.,0,0,0,0,0,0,0,1
Would you like to know the charity I am talking about?,0,0,0,0,0,0,0,1
It is called Save The Children.,0,0,0,0,0,0,0,1
Yes.,0,0,0,0,0,0,0,1
Ok.,0,0,0,0,0,0,0,1
Thank you.,0,0,0,0,0,0,0,1
"Hello, How are you doing?",0,0,0,0,0,0,0,1
I am doing good.,0,0,0,0,0,0,0,1
"Yes, I can see something which relates to save the children donation.",0,0,0,0,0,0,0,1
"Hello,",0,0,0,0,0,0,0,1
I am well.,0,0,0,0,0,0,0,1
Have you ever heard of Save the Children foundation?,0,0,0,0,0,0,0,1
You can learn more at  URL ,0,0,0,0,0,0,0,1
Thank you!,0,0,0,0,0,0,0,1
I do as well.,0,0,0,0,0,0,0,1
Thank you very much!,0,0,0,0,0,0,0,1
"Yes, of course.",0,0,0,0,0,0,0,1
For all we know this is theoretical money.,0,0,0,0,0,0,0,1
Yeah I understand that.,0,0,0,0,0,0,0,1
Hi!,0,0,0,0,0,0,0,1
Have you heard of Save the Children?,0,0,0,0,0,0,0,1
Yes!,0,0,0,0,0,0,0,1
What about you?,0,0,0,0,0,0,0,1
That's great!,0,0,0,0,0,0,0,1
That's so great!,0,0,0,0,0,0,0,1
Thanks for your help!,0,0,0,0,0,0,0,1
Indeed.,0,0,0,0,0,0,0,1
I want to make everything clear now.,0,0,0,0,0,0,0,1
You can find that out on their website,0,0,0,0,0,0,0,1
Hi there!,0,0,0,0,0,0,0,1
How are you today?,0,0,0,0,0,0,0,1
I am doing really great.,0,0,0,0,0,0,0,1
"Ah, yes.",0,0,0,0,0,0,0,1
Yes!,0,0,0,0,0,0,0,1
It really is.,0,0,0,0,0,0,0,1
Wow!,0,0,0,0,0,0,0,1
That is so great to hear.,0,0,0,0,0,0,0,1
Did you have any other questions about STC?,0,0,0,0,0,0,0,1
Would you like to have the site info?,0,0,0,0,0,0,0,1
Hi,0,0,0,0,0,0,0,1
i am good..thank u..,0,0,0,0,0,0,0,1
"this donation is for ""save the children"" purpose",0,0,0,0,0,0,0,1
"the charity name is ""save the children""",0,0,0,0,0,0,0,1
Your donation will be directly deducted from your task payment.,0,0,0,0,0,0,0,1
that' s ok.. you will get more chances to donate.,0,0,0,0,0,0,0,1
URL ,0,0,0,0,0,0,0,1
hello,0,0,0,0,0,0,0,1
so some charities steal and some do the gods work?,0,0,0,0,0,0,0,1
if they get couch what would be the sentence? ,0,0,0,0,0,0,0,1
"the firs question, If they got caught stealing from a charity?",0,0,0,0,0,0,0,1
and if they dont manage the funds correctly ?,0,0,0,0,0,0,0,1
you think that the money managing and where the money go must be transparent?,0,0,0,0,0,0,0,1
did happen something recently about a charity fraud? ,0,0,0,0,0,0,0,1
what was the most amount collected in a charity?,0,0,0,0,0,0,0,1
"last question, what is your impressions about save the children charity?",0,0,0,0,0,0,0,1
Hello!,0,0,0,0,0,0,0,1
You can donation any part of the funds you get from this study!,0,0,0,0,0,0,0,1
its that easy,0,0,0,0,0,0,0,1
what are your questions,0,0,0,0,0,0,0,1
Thank you too,0,0,0,0,0,0,0,1
hi.,0,0,0,0,0,0,0,1
Dpo you about Save the Children organizatio,0,0,0,0,0,0,0,1
Its very important what they do.,0,0,0,1,0,0,0,0
yes the child save vert important conversation. ,0,0,0,1,0,0,0,0
Can you think about someone else but yourself?,0,0,1,0,0,0,0,0
"You might think you don't need friends, but you do.",0,0,1,0,0,0,0,0
hai hello ...,0,0,0,0,0,0,0,1
super great ...  ,0,0,0,0,0,0,0,1
But if you have already ransacked your home for goods to donate.,0,0,0,0,0,0,0,1
Make yourself clear.,0,0,0,0,0,0,0,1
"You might think you don't need friends, but you do.",0,0,0,0,0,0,0,1
thank you so much... ,0,0,0,0,0,0,0,1
Save the Children,0,0,0,0,0,0,0,1
The average is $50.,0,0,0,0,0,0,0,1
That would be great!,0,0,0,0,0,0,0,1
You may send a check or donate oonline.,0,0,0,0,0,0,0,1
You should make it out to Save the Children.,0,0,0,0,0,0,0,1
That is the only charity I am asking about today.,0,0,0,0,0,0,0,1
Would you like to know more about it?,0,0,0,0,0,0,0,1
Yes!,0,0,0,0,0,0,0,1
Hi there,0,0,0,0,0,0,0,1
I'm doing great thank you ,0,0,0,0,0,0,0,1
Great!,0,0,0,0,0,0,0,1
We appreciate you support your donation will be directly deducted from your task payment,0,0,0,0,0,0,0,1
Thank You.,0,0,0,0,0,0,0,1
If you would like additonal information you can refer to Save the Children's website to gather more information if you like to.,0,0,0,0,0,0,0,1
URL,0,0,0,0,0,0,0,1
Yes it is a great read and updated regularly & thank you for your support,0,0,0,0,0,0,0,1
We're almost finished do mine if I ask a few more questions?,0,0,0,0,0,0,0,1
Sorry I apolgize I meant do you have any more questions?,0,0,0,0,0,0,0,1
It is for the charity Save the Children. ,0,0,0,0,0,0,0,1
"No, I think they mean reducing your payment for this study and giving the difference to Save the Children.",0,0,0,0,0,0,0,1
"I suspect that in the following part of the study, the researchers will ask how much of the money you want to donate.",0,0,0,0,0,0,0,1
I have to admit these mturk studies don't even pay you enough for a cup of coffee.,0,0,0,0,0,0,0,1
"Wow, that's much more than the study is supposed to pay me!",0,0,0,0,0,0,0,1
Thank you.,0,0,0,0,0,0,0,1
I believe this completes my part of the study.,0,0,0,0,0,0,0,1
Hi.,0,0,0,0,0,0,0,1
Are you a bot?,0,0,0,0,0,0,0,1
So my task is to convince you to donate,0,0,0,0,0,0,0,1
It doesn't say.,0,0,0,0,0,0,0,1
And I don't think it will require you to donate.,0,0,0,0,0,0,0,1
You just need to say yes at the end of the chat,0,0,0,0,0,0,0,1
According the instructions: ,0,0,0,0,0,0,0,1
The charity is Save the Children.  ,0,0,0,0,0,0,0,1
What is your task anyway?,0,0,0,0,0,0,0,1
"As stated before, I'm supposed to convince you",0,0,0,0,0,0,0,1
Hello how are you doing?,0,0,0,0,0,0,0,1
"Have you heard of a foundation called ""Save The Children""?",0,0,0,0,0,0,0,1
It really is.,0,0,0,0,0,0,0,1
Thank you again!,0,0,0,0,0,0,0,1
Save the Children is its name.,0,0,0,0,0,0,0,1
What do you mean by anything big?,0,0,0,0,0,0,0,1
That's always horrible.,0,0,0,0,0,0,0,1
Hi!,0,0,0,0,0,0,0,1
How are you doing today?,0,0,0,0,0,0,0,1
The research team will collect all the donations and send it to Save the Children.,0,0,0,0,0,0,0,1
"You can find more information at their website,  URL",0,0,0,0,0,0,0,1
Your donation will be directly deducted from your task payment.,0,0,0,0,0,0,0,1
Thank you for very much.,0,0,0,0,0,0,0,1
You don't know how many people would not even think twice about helping those in need.,0,0,0,0,0,0,0,1
Thank you,0,0,0,0,0,0,0,1
Thank you.,0,0,0,0,0,0,0,1
I just have one more question... ,0,0,0,0,0,0,0,1
What was the deciding factor that convinced you to donate to Save the Children?,0,0,0,0,0,0,0,1
That's awesome.,0,0,0,0,0,0,0,1
Thank you once again for your contribution.,0,0,0,0,0,0,0,1
The research team will collect the donation and send it straight to Save the Children.,0,0,0,0,0,0,0,1
Thank you!,0,0,0,0,0,0,0,1
You as well! ,0,0,0,0,0,0,0,1
Hello...!,0,0,0,0,0,0,0,1
Hi.. ,0,0,0,0,0,0,0,1
yes..!,0,0,0,0,0,0,0,1
save the children...,0,0,0,0,0,0,0,1
Which charity you donate? ,0,0,0,0,0,0,0,1
which type of categories to help the childrens?,0,0,0,0,0,0,0,1
yea...!,0,0,0,0,0,0,0,1
it is nice to hear...,0,0,0,0,0,0,0,1
Am from Texas,0,0,0,0,0,0,0,1
Hello,0,0,0,0,0,0,0,1
St Jude is a great foundation.,0,0,0,0,0,0,0,1
The research team will collect all donations and send it to Save the Children.,0,0,0,0,0,0,0,1
Okay that sounds great!,0,0,0,0,0,0,0,1
You are welcome.,0,0,0,0,0,0,0,1
