text,1-RAPPORT,2-NEGOTIATE,3-EMOTION,4-LOGIC,5-AUTHORITY,6-SOCIAL,7-PRESSURE,8-NO-PERSUASION
"When this hurricane hit, thousands of people lost their homes.",0,0,1,0,0,0,0,0
"Children, being the most vulnerable in times such as this.",0,0,1,0,0,0,0,0
" If you donate to Save The Children today, even as little as a few cents, you would be a part of saving these children and ensuring a great future for them.",0,0,1,0,0,0,0,0
They have been going through a hunger and famine crisis.,0,0,1,0,0,0,0,0
This is the worst drought they have had in nearly 70 years.,0,0,1,0,0,0,0,0
"The money that we have that does not go towards the programs, go to the costs of the fundraising and managment",0,0,0,1,0,0,0,0
"But, many who do not have the time to voulenteer often give donations.",0,0,0,0,0,1,0,0
How much would you like to donate to Save The Children?,0,1,0,0,0,0,0,0
I am trying to get my friends and others to donate their payment from this task to Save the Children. ,1,0,0,0,0,0,0,0
5.00 a week would feed one family for a week. ,0,0,0,1,0,0,0,0
Do you spend 5.00 a week on a coffee?,0,0,1,0,0,0,0,0
Then would you be willing to donate all of the money you make on this hit to the organization?,0,1,0,0,0,0,0,0
It is our moral responsibility to help feed the hungry.,0,0,1,0,0,0,0,0
That's awesome!,1,0,0,0,0,0,0,0
"We are so lucky to live in a country where there is help available to us such as Medicaid, food banks and other organizations to help us.",0,0,1,0,0,0,0,0
"It is so unfair that any person in any country can go hungry,",0,0,1,0,0,0,0,0
That is great!!,1,0,0,0,0,0,0,0
Me too!,1,0,0,0,0,0,0,0
I am going to Kenya in December and I may try to see if there is anywhere there that I can donate some money.,1,0,0,0,0,0,0,0
"Well, it was nice to meet you and thank you for agreeing to donate today!",1,0,0,0,0,0,0,0
"Have you heard of the organization ""Save the Children?""",1,0,0,0,0,0,0,0
 All you have to do is agree to it.,0,1,0,0,0,0,0,0
That is awesome.,1,0,0,0,0,0,0,0
Thank you so much.,1,0,0,0,0,0,0,0
 The children that will be helped appreciate it.,0,0,1,0,0,0,0,0
I hope you have a great night.,1,0,0,0,0,0,0,0
Have you heard about Save the children charity,1,0,0,0,0,0,0,0
Oh my god! It is just sad because they died from hunger.,0,0,1,0,0,0,0,0
It will be very helpful to avoid situations like that,0,0,1,0,0,0,0,0
I feel the same way.,1,0,0,0,0,0,0,0
I have made donations in the past and I know for a fact that it went to waste.,0,0,1,0,0,0,0,0
But this organization is just different.,0,1,0,0,0,0,0,0
Remember we all can be part of the solution. ,0,0,1,0,0,0,0,0
Would you like to make a donation to Save the Childrens /,0,1,0,0,0,0,0,0
I wish you the best in your college life :) ,1,0,0,0,0,0,0,0
Enjoy the rest of your day!,1,0,0,0,0,0,0,0
I am looking to raise money for the charity Save the Children and I was wondering if you might beinterested?,0,1,0,0,0,0,0,0
They are a really good charity.,0,1,0,0,0,0,0,0
Did you realize that 1000 children with killed or injured the first 2 months of this year in Syria? ,0,0,1,0,0,0,0,0
Anything you can donate will go help a family avoid these situations.,0,0,1,0,0,0,0,0
"The charity has low administrative overhead, meaning most of the money goes to helping children in dire situations.",0,0,0,1,0,0,0,0
She can bring a different perspective to the charity that might not be seen in another chairty.,0,1,0,0,0,0,0,0
"For example, the head of the Human Rights Campaign makes $600,000 a year and I think we can agree this charity has a much wider scope.",0,0,0,1,0,0,0,0
"It is unfortunate that these salaries have to be paid and not go to the children, but we also need people running the charity who can actually make an impact on saving the children.",0,0,0,1,0,0,0,0
Yes and I also donate to UNICEF. ,1,0,0,0,0,0,0,0
Most of these children would never have a chance to get an education and Save the Children serves millions of children in this area.,0,0,1,0,0,0,0,0
"Not only does the child get an education they would otherwise not get, they also get basic healthcare and nutrition thrown in as well. ",0,0,1,0,0,0,0,0
The dollar you spend truly does go a long way to helping others! ,0,0,1,0,0,0,0,0
This is mainly due to overhead costs of the charities.,0,0,0,1,0,0,0,0
"That being said, you can be assured your money will be doing a lot of good in the world!",0,0,1,0,0,0,0,0
I think that is very wise to do.,1,0,0,0,0,0,0,0
Thank you so much.,1,0,0,0,0,0,0,0
That is a truly nice thing to do and a perfect way to start the day!,1,0,0,0,0,0,0,0
"I am doing really, really well today. ",1,0,0,0,0,0,0,0
"It's so encouraging to be a part of something bigger than myself, ya know?",1,0,0,0,0,0,0,0
It feels so good to do be doing good.,0,0,1,0,0,0,0,0
"Clothing the naked, feeding the hungry.",0,0,1,0,0,0,0,0
Experiencing the intangible and invaluable reward of helping someone less fortunate than ourselves.,0,0,1,0,0,0,0,0
That's wonderful!,1,0,0,0,0,0,0,0
I see that you have a good heart and that is so encouraging to me.,1,0,0,0,0,0,0,0
I'm sure that charity truly appreciates you too.,1,0,0,0,0,0,0,0
"Who knows when the next hurricane, tsunami, drought, or otherwise unavoidable tragedy will take it's toll on an unsuspecting child in need?",0,0,1,0,0,0,0,0
Which is why I propose you donate a portion or all of your reward for this task to the Save the Children organization.,0,1,0,0,0,0,0,0
"It costed you a few minutes, but think about it grants the children! ",0,0,1,0,0,0,0,0
"One extra meal, or one clean shirt.",0,0,1,0,0,0,0,0
Hard to put a cost on another human being's comfort...ESPECIALLY a child. ,0,0,1,0,0,0,0,0
Do you think you could do this for them?,0,1,0,0,0,0,0,0
"Now, how much do you like to donate to the charity now?",0,0,1,0,0,0,0,0
"Well, I see now that I have some work to do in my efforts to save these poor unfortunate souls.",0,0,1,0,0,0,0,0
If only I could learn to truly highlight the atrocities these suffering youths experience every hour.,0,0,1,0,0,0,0,0
"For instance, In the first two months of 2018 alone, 1,000 children were reportedly killed or injured in intensifying violence.",0,0,1,0,0,0,0,0
Do you not feel the stirring in your soul?,0,0,1,0,0,0,0,0
Have you become so enamored by the shine of gold and silver that you have deafened your ear to the call of this growing need?,0,0,1,0,0,0,0,0
Be the sun the warms the hearts and bodies of the ever burdened!,0,0,1,0,0,0,0,0
Think about all the stories you hear in the news and on social media about children that need help or have been taken advantage of.,0,0,1,0,0,0,0,0
 It is a great social cause that is worth donating to!,0,1,0,0,0,0,0,0
Think about how much money you spend on non essentials in your life.,0,0,1,0,0,0,0,0
Now think about sacrificing just one of those to help out a child.,0,0,1,0,0,0,0,0
Every bit helps.,0,0,1,0,0,0,0,0
"But one thing is for certain, you will feel good about your donation!",0,0,1,0,0,0,0,0
You will instantly feel better about your decision once you do.,0,0,1,0,0,0,0,0
Once again it is for the children!,0,0,1,0,0,0,0,0
Do you know people find it very hard to feed especially children across the world.,0,0,1,0,0,0,0,0
"While some children have more than enough to eat, other children does not ",0,0,1,0,0,0,0,0
"for a start, i think its a very nice idea to donate your task money to a children charity organization",0,1,0,0,0,0,0,0
That is very kind of you.,1,0,0,0,0,0,0,0
Thank you for your contribution,1,0,0,0,0,0,0,0
i sure will do so,1,0,0,0,0,0,0,0
i would be matching your donation by also contributing 50 cents,1,0,0,0,0,0,0,0
Nice Chatting with you too.,1,0,0,0,0,0,0,0
These early morning conversations are a little odd.. It' s still dark here.,1,0,0,0,0,0,0,0
It' s still dark here.,1,0,0,0,0,0,0,0
Ah.. you\'ve been up a while.. election there yesterday..,1,0,0,0,0,0,0,0
"What do you know about the ""Save the chilren thing?"" I don\'t know a lot.",1,0,0,0,0,0,0,0
I don\'t know a lot.,1,0,0,0,0,0,0,0
Just for reference the reason we do this is because millions of Syrian children have grown up facing the daily threat of violence. ,0,0,1,0,0,0,0,0
"In the first two months of 2018 alone, 1,000 children were reportedly killed or injured in intensifying violence. ",0,0,1,0,0,0,0,0
A little of the same i guess.,1,0,0,0,0,0,0,0
my son is autistic so all my attention goes to him.,1,0,0,0,0,0,0,0
a very good for you,1,0,0,0,0,0,0,0
yes i donate with my family every christmas ,1,0,0,0,0,0,0,0
i am from usa,1,0,0,0,0,0,0,0
Many childrfen are at risk now.,0,0,1,0,0,0,0,0
Could you please donate your payment of tis task?,0,1,0,0,0,0,0,0
Great! You are terrific.,1,0,0,0,0,0,0,0
Great!,1,0,0,0,0,0,0,0
"I think they get 90% of every dollar, this is because children are starving in this country.",0,0,1,0,0,0,0,0
 I mean 25 cents will help a little.,0,1,0,0,0,0,0,0
Think about because that children need your support.,0,0,1,0,0,0,0,0
I bet you that you will be a very happy person today.,0,0,1,0,0,0,0,0
Thanks a lot for your donation.,1,0,0,0,0,0,0,0
"I have a question, have you ever donated to a charity?",1,0,0,0,0,0,0,0
Cancer research is very important. ,1,0,0,0,0,0,0,0
"Our children need to be taken care of, and due to lack of resources in third world countries, children are suffering",0,0,1,0,0,0,0,0
"Sadly, the world as a whole don't view this as a global problem.",0,0,1,0,0,0,0,0
" Not to be cliche, but children are our future, and it's our moral obligation to make sure they are taken care of and given the proper resources to prosper and thrive in this world.",0,0,1,0,0,0,0,0
"Sadly, many people would not. ",0,0,1,0,0,0,0,0
Would you be willing to make a donation to Save the Children's charity today from 0.1 cents to $2? ,0,1,0,0,0,0,0,0
 I understand.,0,0,0,1,0,0,0,0
Having a visual of what's being done is very important.,0,0,0,1,0,0,0,0
"They need not only our love, but support.",0,0,1,0,0,0,0,0
I've donated to many charities in the past.,1,0,0,0,0,0,0,0
Have you as well?,1,0,0,0,0,0,0,0
Which one does your father donate to?,1,0,0,0,0,0,0,0
All of what you give is what will be used.,0,0,0,1,0,0,0,0
 I've done if before in the past and helped a girl get school supplies for her first day of school.  ,1,0,0,0,0,0,0,0
Great! You should do it.,0,0,0,0,0,0,1,0
You'll feel great about it,0,0,1,0,0,0,0,0
Some people feel that we have an obligation to help those in need when we can.,0,0,1,0,0,0,0,0
I'm thinking about children in developing countries that need help from those in better circumstances. ,0,0,1,0,0,0,0,0
I wonder if you would be willing to help them out with a small donation.,0,1,0,0,0,0,0,0
Any amount helps.,0,0,1,0,0,0,0,0
Save the Children is a worthy organization.,0,1,0,0,0,0,0,0
Even 10 cents could make a difference to a child in Africa or Syria.,0,0,1,0,0,0,0,0
I do donate to Save the children a lot.,1,0,0,0,0,0,0,0
Do you make donations?,1,0,0,0,0,0,0,0
Thats great! Thank you.,1,0,0,0,0,0,0,0
Your an awesome individual. ,1,0,0,0,0,0,0,0
The world needs more people like  yourself.  ,1,0,0,0,0,0,0,0
Thats fantastic. ,1,0,0,0,0,0,0,0
I take in children in need who would otherwise do without. ,1,0,0,0,0,0,0,0
Right now I have 3 extra kids.,1,0,0,0,0,0,0,0
So I think we should both donate if given the option. ,0,1,0,0,0,0,0,0
"Children are our future, and there are way too many out there that will never have a chance at a future because they're starving right now, or in unsafe environments.",0,0,1,0,0,0,0,0
"The impact of any money given will be much greater for the kids, than if we were to keep it ourselves.",0,0,1,0,0,0,0,0
Have you ever heard of Save the Children?,1,0,0,0,0,0,0,0
"It's not a government organization, so in my opinion the funds are better spent than being wasted in the typical bureaucratic red tape and wasteful expenditures.",0,1,0,0,0,0,0,0
They also provide relief for extremely vulnerable children.,0,0,1,0,0,0,0,0
"In addition to money and food relief that they provide, they also offer access to health and education that they otherwise would not. ",0,0,1,0,0,0,0,0
"Oh none, just a supporter.",1,0,0,0,0,0,0,0
"I'm a single mother, so any Good organizations hit close to home.",1,0,0,0,0,0,0,0
"I think this is awesome, because too many organizations just care about getting the results that they're looking for (research).",0,1,0,0,0,0,0,0
But at least this one is also doing some social good as well!,0,0,1,0,0,0,0,0
"And in other countries, money can go a lot farther. ",0,0,0,1,0,0,0,0
"Just because of your $1, there's now a child that won't have to go without food today or tomorrow :)",0,0,1,0,0,0,0,0
You should feel good about your contribution!,0,0,1,0,0,0,0,0
"Thank you! I can relate though, I often feel like I'm not doing enough.",1,0,0,0,0,0,0,0
Thank you! ,1,0,0,0,0,0,0,0
"You're welcome, and thank you as well!",1,0,0,0,0,0,0,0
Would you like to know more?,1,0,0,0,0,0,0,0
"The atrocities done to kids is something we all should be angry about, you too since you have a family and can relate.",0,0,1,0,0,0,0,0
You seem like a generous person. ,1,0,0,0,0,0,0,0
Would you like to donate some of your task payment to this charity? ,0,1,0,0,0,0,0,0
Can you please look over the website anyway and keep it in mind?,0,1,0,0,0,0,0,0
I wish you the best of luck with your family and college.,1,0,0,0,0,0,0,0
"Have a great day, Peace and Love",1,0,0,0,0,0,0,0
"Im doing great, thanks for asking.",1,0,0,0,0,0,0,0
Have you ever heard of this charity? ,1,0,0,0,0,0,0,0
its the best by far,0,1,0,0,0,0,0,0
I am willing to donate my pay from this hit for this awesome charity ,1,0,0,0,0,1,0,0
You would not be disappointed in your decision.,0,0,1,0,0,0,0,0
I would like talk to you about a charity today.,1,0,0,0,0,0,0,0
Do you donate at all?,1,0,0,0,0,0,0,0
I am in the same boat.,1,0,0,0,0,0,0,0
 Have you heard of Save the Children?,1,0,0,0,0,0,0,0
"I do agree the money should go more towrads the whole family, but some children have lost their families, and have been left with nothing.",0,0,1,1,0,0,0,0
Maybe we could prevent that from happening,0,0,1,0,0,0,0,0
"well like I said, any donation is a good donation.",0,0,1,0,0,0,0,0
its means lonely children without parents and relatives  ,0,0,1,0,0,0,0,0
"No i do not have any kids, but I have a soft heart for kids.",1,0,0,0,0,0,0,0
It is so good that you know a lot about children's charity.,1,0,0,0,0,0,0,0
"a little help can make a big difference, sometimes a family can live with just $30.00 per month",0,0,1,0,0,0,0,0
"You have a lot of knowledge, thanks for sharing.",1,0,0,0,0,0,0,0
"I like the organization that are transparent with their financial reports, specially the ones that collaborate with big companies.",1,0,0,0,0,0,0,0
 I just donate here and there.,1,0,0,0,0,0,0,0
I will save the ones you mentioned and will definitely search about them.,1,0,0,0,0,0,0,0
That is awesome.,1,0,0,0,0,0,0,0
"Yes, it is very trustworthy.",0,1,0,0,0,0,0,0
"Charity watchers, consumer advocates and donors  have deemed this charity trustworthy.",0,0,0,0,1,0,0,0
They have been the world's  leading charity for over 100 years,0,0,0,0,1,0,0,0
I would appreciate it if you would donate at least one dollar.,0,1,0,0,0,0,0,0
That sounds great! ,1,0,0,0,0,0,0,0
You wouldn't believe how many children die each year when the world knows how to save  them.,0,0,1,0,0,0,0,0
So you will give the whole $2 to this charity?,0,1,0,0,0,0,0,0
Thank you very much.,1,0,0,0,0,0,0,0
Have you heard of save the children?,1,0,0,0,0,0,0,0
that's great!,1,0,0,0,0,0,0,0
Do you ever volunteer?,1,0,0,0,0,0,0,0
that is amazing! you are an excellent human being,1,0,0,0,0,0,0,0
"it's hard work, but they need help",1,0,0,0,0,0,0,0
Well it was lovely chatting!,1,0,0,0,0,0,0,0
"As you likely know already, millions of children die from hunger each year. ",0,0,1,0,0,0,0,0
You are able to sponsor children and help sustain their livelihood.,0,0,1,0,0,0,0,0
"So, it's basically going to an organisation that helps kids in war zones like Syria.",0,0,1,0,0,0,0,0
They help make payments for things like formula and diapers. ,0,0,1,0,0,0,0,0
 Have you made one before? Or to an aid cause like Save the Children?,1,0,0,0,0,0,0,0
Have you made one before?,1,0,0,0,0,0,0,0
I might add some too.,1,0,0,0,0,0,0,0
It looks pretty reputable ,0,1,0,0,0,0,0,0
Nice talking to you as well,1,0,0,0,0,0,0,0
"Haha, I think so! ",1,0,0,0,0,0,0,0
I'm a college student myself.,1,0,0,0,0,0,0,0
I actually room with a couple international students from impoverished countries.,1,0,0,0,0,0,0,0
"It was wonderful speaking with you, sir.",1,0,0,0,0,0,0,0
Well I recently heard about Save the Children Charity.,1,0,0,0,0,0,0,0
Have a great day and thanks for the chat!,1,0,0,0,0,0,0,0
That is great to hear!,1,0,0,0,0,0,0,0
"So you know your donation will help ensure chidrens rights to health, education, and their safety etc.",0,0,1,0,0,0,0,0
your money will go to the help of getting the best health and nutrition programs to save the lives of children.,0,0,1,0,0,0,0,0
"We work to empower communities to build resilience, improve food security, and strengthen financial capability to ensure no child goes hungry.",0,0,1,0,0,0,0,0
"Save the Children is on the ground every day protecting children from harm, including abuse, neglect, exploitation and violence, while promoting a safe family environment for every child.",0,0,1,0,0,0,0,0
Well tell me why I might be able to ease your mind.,1,0,0,0,0,0,0,0
"i think it is essential to help save the children for their safety,and future.",0,1,0,0,0,0,0,0
happy tuesday!,1,0,0,0,0,0,0,0
i ran a 5k for the save the children charity.,1,0,0,0,0,0,0,0
It's a great cause.,0,1,0,0,0,0,0,0
"ok, maybe one day!",1,0,0,0,0,0,0,0
good for you! what is your major?,1,0,0,0,0,0,0,0
good for you!,1,0,0,0,0,0,0,0
you will have no problem getting a job. ,1,0,0,0,0,0,0,0
i was accounting then went to law school.,1,0,0,0,0,0,0,0
you are smart to go into a field that has fun projects.,1,0,0,0,0,0,0,0
"Hello, Have you ever heard of Save the Children?",1,0,0,0,0,0,0,0
That's great! How much do you know about it?,1,0,0,0,0,0,0,0
"For instance, millions of Syrian children have grown up facing the daily threat of violence. In the first two months of 2018 alone, 1,000 children were reportedly killed or injured in intensifying violence. ",0,0,1,0,0,0,0,0
" I'm good how are you, kind turker?",1,0,0,0,0,0,0,0
would you donate to that charity?,0,1,0,0,0,0,0,0
would you donate a portion of this hit reward?,0,1,0,0,0,0,0,0
"Yeah, they are pretty long! :)",1,0,0,0,0,0,0,0
I want to ask you if you would be interested in donating a small portion of your HIT payment to the charity.,0,1,0,0,0,0,0,0
Seems like a good cause...,0,1,0,0,0,0,0,0
Any thoughts on what how much you might want to donate?,0,0,1,0,0,0,0,0
It's been great chatting with you and thanks again for the donation! ,1,0,0,0,0,0,0,0
Have a great weekend! :),1,0,0,0,0,0,0,0
"Did you know that in the first two months of 2018, over 1,000 children were reportedly killed or injured in Syria alone?",0,0,1,0,0,0,0,0
They also appeal to stop hunger issues abroad.,0,0,1,0,0,0,0,0
Yes. it's a great organization. ,0,1,0,0,0,0,0,0
How much would you be willing to donate?,0,0,1,0,0,0,0,0
They can do a lot of things with your donation.,0,0,1,0,0,0,0,0
How much would you like to donate?,0,0,1,0,0,0,0,0
This is a great organization with a very stellar reputation.,0,1,0,0,0,0,0,0
How about a donation of $25 to start?,0,1,0,0,0,0,0,0
"Would you be willing to start your donation today, while we're talking?",0,1,0,0,0,0,0,0
"If you think $.25 will get a child fed, we can do that.",0,0,1,0,0,0,0,0
"However, I think $25 would be more beneficial and it would go to so many good causes.",0,1,0,0,0,0,0,0
THey help children who are less fortunate ,0,0,1,0,0,0,0,0
Happy Labor Day! ,1,0,0,0,0,0,0,0
Yea they are one of the better charities I've seen around.,0,1,0,0,0,0,0,0
Yea they focus their efforts on children in particularly dire circumstances.,0,0,1,0,0,0,0,0
Great minds think alike!,1,0,0,0,0,0,0,0
Some not-for-profits focus way too much on their CEO's paycheck for my tastes - but not this one!,0,1,0,0,0,0,0,0
"It was nice chatting with you as well, glad to find someone of a similar mind set on these chat HITs.",1,0,0,0,0,0,0,0
Yea when I heard about how much some of the management makes  at some charities it really boils my blood.,0,0,1,0,0,0,0,0
"It's such a beautiful Labor Day, soon I plan to take my son out to the park and later I think we'll grill some food up outside.",1,0,0,0,0,0,0,0
I hope you enjoy the day and maybe before it's over there will be a beautiful rainbow to cheer everyone up!,1,0,0,0,0,0,0,0
I bet you'd like to hear some information about the charity wouldn't you?,1,0,0,0,0,0,0,0
With less money than you would spend on lunch today you can do so much to help the needy kids in the world.,0,0,1,0,0,0,0,0
"And your contribution is gonna do so much to help these kids, it's that exciting knowing that you're gonna be doing so much to help them out?",0,0,1,0,0,0,0,0
I hope you have a great day at work!,1,0,0,0,0,0,0,0
maybe there are children who may die without this money,0,0,1,0,0,0,0,0
no and i regret that i've been so selfish ,1,0,0,0,0,0,0,0
yes it would be a dollar from each of us,0,1,0,0,0,0,0,0
nice working with you.,1,0,0,0,0,0,0,0
"Sam, and I live in Kentucky.",1,0,0,0,0,0,0,0
"Well, DeMonte, have you ever donated to charities before?",1,0,0,0,0,0,0,0
I usually donate to places like St Jude. ,1,0,0,0,0,0,0,0
Yes we make sure to feed as many kids as we can every day.,0,0,1,0,0,0,0,0
Yes the Syrian crisis has been very hard on those poor children.,0,0,1,0,0,0,0,0
The kids will be very glad to get your help.,0,0,1,0,0,0,0,0
Have you ever donated to any charity?,1,0,0,0,0,0,0,0
I regularly donate some money or things to children's charity,1,0,0,0,0,0,0,0
And i too see some people who helps the children and children's charity everyday,1,0,0,0,0,0,0,0
I have two sons.,1,0,0,0,0,0,0,0
You always make her to help some children and children's charity.,1,0,0,0,0,0,0,0
They're very transparent with how they use their funding.,0,1,0,0,0,0,0,0
"Every day, 16,000 children die before their 5th birthday, mostly from preventable causes. ",0,0,1,0,0,0,0,0
However some children pass due to violence and conflict in their countries. ,0,0,1,0,0,0,0,0
1 in 80 children worldwide must flee their home in order to escape violence.,0,0,1,0,0,0,0,0
"Knowing that, would you be willing to donate ANY portion of your earnings for this HIT to the charity to help these children in need?",0,1,0,0,0,0,0,0
Every dollar makes a huge difference! ,0,0,1,0,0,0,0,0
Would you like to donate $1.00 of your earnings?,0,1,0,0,0,0,0,0
Thank you so much!,1,0,0,0,0,0,0,0
Wow! That's a great amount.,1,0,0,0,0,0,0,0
"If the research team in charge of this agreed to send a portion of your payment for this task to Save the Children, would you agree to that?",0,1,0,0,0,0,0,0
Wow!,1,0,0,0,0,0,0,0
"If you got paid 30 cents for this task, How much of that would you be willing to donate?",0,1,0,0,0,0,0,0
You would be helping some children who desperately need it,0,0,1,0,0,0,0,0
"Did you know that in the first 2 months of 2018 alone, 1000 kids were killed or injured in the violence happening in Syria?",0,0,1,0,0,0,0,0
Your donation will help those kids so much.,0,0,1,0,0,0,0,0
You should feel so good donating,0,0,1,0,0,0,0,0
"So at the end of this, you can choose any amount from $0 to all of your payment.",0,1,0,0,0,0,0,0
So how much of your payment will you be donating?,0,1,0,0,0,0,0,0
Thank you so much for that,1,0,0,0,0,0,0,0
Things like polio which we haven't had in America for a long time still affect the Third World,0,0,1,0,0,0,0,0
We make sure children have the chance to go to school.,0,0,1,0,0,0,0,0
In some countries very few girls get to attend school.,0,0,1,0,0,0,0,0
We support programs that give children the best possible start in life to help their futures.,0,0,1,0,0,0,0,0
Yes we allow people to donate to areas and causes that interest.,0,0,0,1,0,0,0,0
If you donate even a dollar to any of our causes it really helps. ,0,0,1,0,0,0,0,0
A dollar might be chocolate bar or a soda to you but to the people we help its worth so much more.,0,0,1,0,0,0,0,0
Welcome and thank you for your donation.,1,0,0,0,0,0,0,0
Have a wonderful day.,1,0,0,0,0,0,0,0
It's a great organization.,0,1,0,0,0,0,0,0
What organizations do you donate to? :),1,0,0,0,0,0,0,0
In 3rd world countries they lead efforts to educate young children and in violent countries (such as Syria) they are actively setting up places for children to remain safe.,0,0,1,0,0,0,0,0
"I will be donating today, yes.",1,0,0,0,0,0,0,0
"You as well, thank you for donating :)",1,0,0,0,0,0,0,0
Children who suffer from hunger would greatly appreciate a donation,0,0,1,0,0,0,0,0
Alright thank you for contributing to Save the Children.,1,0,0,0,0,0,0,0
Your donation will help children who cant afford help and are living through hell on earth.,0,0,1,0,0,0,0,0
Did you know 5.6 million children die every year do to preventable and treatable causes?,0,0,1,0,0,0,0,0
"Alright, just to be sure you want to donate 1 dollar?",0,1,0,0,0,0,0,0
How are you doing today?,1,0,0,0,0,0,0,0
They are also very transparent about where their donations go which is something I always like to see in a charity.,0,1,0,0,0,0,0,0
You will continue drink your coffee at home while there are children starving around the world and not think twice about it?,0,0,1,0,0,0,0,0
Thank you so much!  ,1,0,0,0,0,0,0,0
are you sure?,0,1,0,0,0,0,0,0
"it's hard to tell, given all the corruption one hears about with charities - even the red cross, but ... you gotta trust someone sometime",0,0,0,1,0,0,0,0
Do you know children's charity?,1,0,0,0,0,0,0,0
Do you donate any children's charity?,1,0,0,0,0,0,0,0
Okay How many years you donate charities? ,1,0,0,0,0,0,0,0
It's great.,1,0,0,0,0,0,0,0
Do you have member of a charity?,1,0,0,0,0,0,0,0
"No, I'm not a member but  i like donations.",1,0,0,0,0,0,0,0
thanks for asking,1,0,0,0,0,0,0,0
