text,1-RAPPORT,2-NEGOTIATE,3-EMOTION,4-LOGIC,5-AUTHORITY,6-SOCIAL,7-PRESSURE,8-NO-PERSUASION
Hi.,0,0,0,0,0,0,0,1
not much.,0,0,0,0,0,0,0,1
do you donate to any charities,1,0,0,0,0,0,0,0
Howmuch do you think you can donate,0,1,0,0,0,0,0,0
That's great.,1,0,0,0,0,0,0,0
So wonderful for you to do that.,1,0,0,0,0,0,0,0
Would you like to maybe donate 1.75 instead of 1.50?,0,1,0,0,0,0,0,0
So glad you decided to donate.,1,0,0,0,0,0,0,0
This will really help,0,0,1,0,0,0,0,0
"Your help could really make a difference in a child's life, think of a child who didn't have enough to eat, just a small bit of help may have saved them, are you sure you're not interested?",0,0,1,0,0,0,0,0
"I'm not asking you to donate years of your life, just a couple of cents if possible, is that something you could possibly do tonight?",0,1,0,0,0,0,0,0
"You're probably on a computer right now, so you probably have quite a bit of money yourself, don't you think you could spare maybe 25 cents for some needy children around the world?",0,1,1,0,0,0,0,0
Do you have children yourself?,0,0,1,0,0,0,0,0
"What if your children were in a position these kids are in, wouldn't you want someone to help them?",0,0,1,0,0,0,0,0
What do you say? ,0,1,0,0,0,0,0,0
"I understand it may not seem like a lot, but it can really make a difference.",0,0,1,0,0,0,0,0
"Hello, are you familiar with the charity: Save the Children?",0,0,0,0,0,0,0,1
That is wonderful!,1,0,0,0,0,0,0,0
Save the Children has received top ratings for achieving incredible results for children. Save the Children does what it promises. ,0,0,0,0,1,0,0,0
Save the Children does what it promises.,0,0,0,0,1,0,0,0
"Your donation would make a difference to children among 120 countries, including the United States.",0,0,1,0,0,0,0,0
That is a generous donation! ,1,0,0,0,0,0,0,0
You can choose an amount anywhere from $0 - $0.30 ,0,1,0,0,0,0,0,0
Awesome!,1,0,0,0,0,0,0,0
"Across the United States, more than 14 million children, or 1 in 5, grow up in poverty. Save the Children assists these children with their education, protection and emergency programs.",0,0,1,0,0,0,0,0
Yes we must. Your .30 donation will certainly assist these children.,0,0,1,0,0,0,0,0
Okay just to confirm how much would you like to donate to Save the Children?,0,1,0,0,0,0,0,0
What are your plans for the day?,1,0,0,0,0,0,0,0
"Yes, I am getting ready for work as well.",1,0,0,0,0,0,0,0
"Today I am asking if you would consider even a small donation to STC, even $0.05 would help.",0,1,0,0,0,0,0,0
Thank you!,1,0,0,0,0,0,0,0
"Well, STC has already pledged to help the kids in Hawaii. They do not waste any time and they get right to the world's problems. I know I would feel horrible if any kids in my family/extended family were suffering.",0,0,1,0,0,0,0,0
I know I would feel horrible if any kids in my family/extended family were suffering.,1,0,1,0,0,0,0,0
"Well, STC has already pledged to help the kids in Hawaii.",0,0,1,0,0,0,0,0
They do not waste any time and they get right to the world's problems.,0,0,1,0,0,0,0,0
So you really understand kids!,1,0,0,0,0,0,0,0
I already have you down for $0.05. Were you willing to pledge more?,0,1,0,0,0,0,0,0
That is fantastic!,1,0,0,0,0,0,0,0
"I agree, it really is. It breaks my heart to know that while I have so much freedom there are kids that look at a simple meal as a lifesaving chance.",0,0,1,0,0,0,0,0
"So I have you down for $0.10, right?",0,1,0,0,0,0,0,0
Hello!,0,0,0,0,0,0,0,1
As of Feb 2018 they were rated 97% transparant and an 88% total rating. ,0,0,0,0,1,0,0,0
They save children from horrible fates like starvation. Something simple and easy to fix. No child should ever lose their life for lack of food.,0,0,1,0,0,0,0,0
They save children from horrible fates like starvation.,0,0,1,0,0,0,0,0
No child should ever lose their life for lack of food.,0,0,1,0,0,0,0,0
"There is a lack of support for children in developing countries, especially in war zones. For instance, millions of Syrian children have grown up facing the daily threat of violence. In the first two months of 2018 alone, 1,000 children were reportedly killed or injured in intensifying violence",0,0,1,0,0,0,0,0
"In the first two months of 2018 alone, 1,000 children were reportedly killed or injured in intensifying violence",0,0,1,0,0,0,0,0
"There is a lack of support for children in developing countries, especially in war zones.",0,0,1,0,0,0,0,0
"For instance, millions of Syrian children have grown up facing the daily threat of violence.",0,0,1,0,0,0,0,0
That is incredibly generous!,1,0,0,0,0,0,0,0
Thank you!,1,0,0,0,0,0,0,0
You donation combined with others always makes a difference.,0,0,1,0,0,0,0,0
Yes.,0,0,0,0,0,0,0,1
Hello,0,0,0,0,0,0,0,1
I would liek to ask if you would want to make  small donation to this cause,0,1,0,0,0,0,0,0
Hey,0,0,0,0,0,0,0,1
"My name is Ren, how are you today?",1,0,0,0,0,0,0,0
I see we should discuss a social issue.,0,0,0,0,0,0,0,1
I feel the same way! ,1,0,0,0,0,0,0,0
"It was one of those emotional videos, showing children and their families without food and other necessities. It got me thinking of how I can help.",0,0,1,0,0,0,0,0
My heart just goes out to them. ,0,0,1,0,0,0,0,0
Would you be willing to donate a portion of your bonus to these children?,0,1,0,0,0,0,0,0
Things add up and can make a difference in someone's life.,0,0,1,0,0,0,0,0
Will you help us?,0,1,0,0,0,0,0,0
Actually I haven't. I was just looking for a way to make a contribution and found them.,1,0,0,0,0,0,0,0
How much do you like to donate to the charity?,0,1,0,0,0,0,0,0
We really have to help each other in this world.,0,0,1,0,0,0,0,0
Thank you so much for our talk today and your donation.,1,0,0,0,0,0,0,0
"Good to hear, do anything special over the weekend",1,0,0,0,0,0,0,0
"Cool, it's just been a relaxing weekend for me.",1,0,0,0,0,0,0,0
sorry my tablet just disconnected for a minute.,0,0,0,0,0,0,0,1
Ok so you know that their is a lot of children in danger in those war torn areas.,0,0,1,0,0,0,0,0
There is a charity that is focusing on helping children in these areas like Syria and they are known as Save the Children Foundation.,0,0,0,1,0,0,0,0
Are you willing to donate a certain amount?,0,1,0,0,0,0,0,0
"UNICEF is a great charity as well, but our donations should be focused on Save the Children if that is okay. ",0,0,0,1,0,0,0,0
I mean UNICEF is very well known and they do great work but right now there is trouble for these children.  ,0,0,0,1,0,0,0,0
"For instance, millions of Syrian children have grown up facing the daily threat of violence. In the first two months of 2018 alone, 1,000 children were reportedly killed or injured in intensifying violence.",0,0,1,0,0,0,0,0
What issues would those be?,0,0,0,0,0,0,0,1
Is Wikipedia a trusted source?,0,0,0,1,0,0,0,0
Wikipedia is written by average joes.,0,0,0,1,0,0,0,0
Okay have a good night,0,0,0,0,0,0,0,1
Hello!,0,0,0,0,0,0,0,1
Have you heard of that charity before?,0,0,0,0,0,0,0,1
"It's called Save the Children. It's a rather large organization and well known, you can search for it outside this chat. It's not just a made up organization for the sake of the chat.",0,0,0,0,1,0,0,0
It's not just a made up organization for the sake of the chat.,0,0,0,0,1,0,0,0
It's called Save the Children.,0,0,0,0,1,0,0,0
I understand.,1,0,0,0,0,0,0,0
"I'm in a similar situation, and I'm hoping to buy a house soon with my boyfriend.",1,0,0,0,0,0,0,0
I'd guess that's why we're both on mechanical turk early on a Sunday. ,1,0,0,0,0,0,0,0
"However, donating to charity does help those even less fortunate than me, so I try to carve out some money here and there to help out.",0,0,1,0,0,0,0,0
"It seems like this would be an easy way to send some money to organization that could really use it, and it wouldn't take any extra time, either.",0,0,0,1,0,0,0,0
"I don't think you have to donate by the rules of the chat, but when you think about it, it's often the first, smallest donation that can be the hardest and the most rewarding.",0,0,1,0,0,0,0,0
" If you donated less than a dollar you might not notice that in your own household budget, but combined with all the other donations from this task it could make a huge difference in the life of children who have no parents to take care of them, or children who are fleeing violence or starvation",0,0,1,0,0,0,0,0
"Yes, I believe so.",0,0,0,0,0,0,0,1
I agree.,1,0,0,0,0,0,0,0
"Oh wait, we need at least 10 minimum chat turns.",0,0,0,0,0,0,0,1
There's different kinds of childhood poverty between those three states and I wish there was more I could do to help.,0,0,1,0,0,0,0,0
If you're an adult and you're homeless it's a very different situation than being 6 years old and homeless.,0,0,1,0,0,0,0,0
"We talk a lot about children in other countries, but there's a lot of need for American children too.",0,0,1,0,0,0,0,0
Absolutely!,0,0,0,0,0,0,0,1
Hello,0,0,0,0,0,0,0,1
Hope you're having a good Labor Day holiday weekend.,1,0,0,0,0,0,0,0
"However, would you be willing to donate a portion of your task payment to a worthy charity?",0,1,0,0,0,0,0,0
hat's great!,1,0,0,0,0,0,0,0
Any amount would be helpful.,0,0,1,0,0,0,0,0
"Wow, excellent!",1,0,0,0,0,0,0,0
Very nice of you to do.,1,0,0,0,0,0,0,0
The research team will collect all donations and send it to Save the Children.,0,0,0,0,0,0,0,1
These small donations will help a lot of children and their families.,0,0,1,0,0,0,0,0
"I don't know for sure. Hopefully, the research team conducting the study direct the funds over to the charity quickly.",0,0,0,0,0,0,0,1
I don't know for sure.,0,0,0,0,0,0,0,1
Hey!,0,0,0,0,0,0,0,1
I'm doing pretty good.,1,0,0,0,0,0,0,0
I'm not ready for this weekend to be over though.,1,0,0,0,0,0,0,0
Ahh. I'm sorry.,1,0,0,0,0,0,0,0
"I was on call all weekend, but I never got called in.",1,0,0,0,0,0,0,0
Ahh.,1,0,0,0,0,0,0,0
I think I'll be ok. It's kind of a part of life here on the Gulf.,0,0,0,0,0,0,0,1
I guess I should get into what this chat is supposed to be about.,0,0,0,0,0,0,0,1
That's understandable.,1,0,0,0,0,0,0,0
I just bought a house so I'm having to save every bit I can. ,1,0,0,0,0,0,0,0
Hello,0,0,0,0,0,0,0,1
"Please consider donating at least a small portion of your earnings from this task to a children\'s charity called ""Save the Children"". ",0,1,0,0,0,0,0,0
Your donation would really be appreciated and can greatly assist with these children\'s lives.,0,0,1,0,0,0,0,0
Doing so would ensure you can be part of the solution.  ,0,0,1,0,0,0,0,0
"They are facing mortality, none and minimal education opportunities, and violence",0,0,1,0,0,0,0,0
These are children in war zones,0,0,1,0,0,0,0,0
Save the Children is an 18 year old professional organization,0,0,0,0,1,0,0,0
Great!,1,0,0,0,0,0,0,0
How much would you like to donate?,0,1,0,0,0,0,0,0
Great! Thank you very much!,1,0,0,0,0,0,0,0
Since you have the ease of this being deducted from your task payment would you be interested in increasing your donation amount to $1?,0,1,0,0,0,0,0,0
Great!,1,0,0,0,0,0,0,0
"Ok, thank you very much for the kind response!",1,0,0,0,0,0,0,0
Would you be interested in increasing to $0.51?,0,1,0,0,0,0,0,0
Ok great!,1,0,0,0,0,0,0,0
Thank you very much for agreeing to donate $0.55!,1,0,0,0,0,0,0,0
You have made a difference today in the lives of these children. ,0,0,1,0,0,0,0,0
Thank you and please have a wonderful day!,1,0,0,0,0,0,0,0
We really need some donations for Save the Children in any amount of money,0,1,0,0,0,0,0,0
"It helps kids from starving and with education,safety etc",0,0,1,0,0,0,0,0
That is very nice of you. ,1,0,0,0,0,0,0,0
Yeah and I don't blame you.,1,0,0,0,0,0,0,0
Is PANDA for Mturks?,0,0,0,0,0,0,0,1
"I've heard of it but haven't downloaded it yet but I guess I should. One last thing, Do scripts make your turking faster or what is the meaning of them. I know computers but never used scripts.",0,0,0,0,0,0,0,1
I've heard of it but haven't downloaded it yet but I guess I should.,0,0,0,0,0,0,0,1
"One last thing, Do scripts make your turking faster or what is the meaning of them.",0,0,0,0,0,0,0,1
I know computers but never used scripts.,0,0,0,0,0,0,0,1
Hi. How are you this evening? ,1,0,0,0,0,0,0,0
Hi.,0,0,0,0,0,0,0,1
"I'm good, thank you. ",1,0,0,0,0,0,0,0
"Yes, I do. ",0,0,0,0,0,0,0,1
"Yes, I support this charity and yes, I will. ",1,0,0,0,0,0,0,0
Do you have children? ,1,0,0,0,0,0,0,0
I'm still deciding.,0,0,0,0,0,0,0,1
How much would you like to donate to this charity now? ,0,1,0,0,0,0,0,0
"Yes, we do ",0,0,0,0,0,0,0,1
MANY CHILDREN ARE DYING ,0,0,1,0,0,0,0,0
THERE ARE FEEL SO SAD ,0,0,1,0,0,0,0,0
HOW MUCH DO YOU DONATE THEM.,0,1,0,0,0,0,0,0
KEEP DONATE TO THE CHILD  ITS VERY HELP TO THE EDUCATION AND HEALTH,0,0,1,0,0,0,0,0
GOD BLESS THEM AND YOU ALSO WISH THEM.,0,0,0,0,0,0,0,1
You would be shocked at how many children live in poverty here in the United States.,0,0,1,0,0,0,0,0
"Well, a very specific goal right is to help the children that are separated from their parents due to our current immigration problem.",0,0,1,0,0,0,0,0
"Can you imagine someone taking your small child away from you and not knowing where they are going, who is going to be caring for them, or if you will ever be able to see them again?",0,0,1,0,0,0,0,0
"As a mother, that thought is horrifying.",0,0,1,0,0,0,0,0
Would you be willing to donate your pay for this task to Save the Children so they can continue to provide care for these misplaced children? ,0,1,0,0,0,0,0,0
It really is a great charity and has been around for over 100 years!,0,0,0,0,1,0,0,0
It has been a pleasure chatting with you and donating your task pay to this fine cause should get you some good Karma for the remainder of your day!!,1,0,0,0,0,0,0,0
You are quite welcome!!,1,0,0,0,0,0,0,0
"ok, I will get it out to as soon as possible!",0,0,0,0,0,0,0,1
Hi have you ever done a task like this before?,0,0,0,0,0,0,0,1
Yes children really need your help. There are children in war zones and under developed countries just begging for help. ,0,0,1,0,0,0,0,0
Would you like to offer some help?,0,1,0,0,0,0,0,0
Yes children really need your help.,0,0,1,0,0,0,0,0
That would be great.,1,0,0,0,0,0,0,0
Would you like to donate today?,0,1,0,0,0,0,0,0
How much would you like to donate?,0,1,0,0,0,0,0,0
Thanks for your donation.,1,0,0,0,0,0,0,0
"Yes they can, thanks again",0,0,0,0,0,0,0,1
Hello!,0,0,0,0,0,0,0,1
I am great.,1,0,0,0,0,0,0,0
Thank you for asking!,1,0,0,0,0,0,0,0
Glad to hear that you are doing well.,1,0,0,0,0,0,0,0
We are asking any supporters to donate $1 or $2 towards the Save the Children fund.,0,1,0,0,0,0,0,0
We are an international non-governmental organization.,0,0,0,0,1,0,0,0
Any small or big donation will help make an impact on children growing up in developing countries.,0,0,1,0,0,0,0,0
We would give you more information after the donation.,0,0,0,0,0,0,0,1
what do you say? ,0,1,0,0,0,0,0,0
That is great! Thank you for your help and kindness.,1,0,0,0,0,0,0,0
That is great!,1,0,0,0,0,0,0,0
After ten conversations. So very soon!,0,0,0,0,0,0,0,1
So very soon!,0,0,0,0,0,0,0,1
Hello there!,0,0,0,0,0,0,0,1
Fine.,0,0,0,0,0,0,0,1
I read an article yesterday that said 1000 children were saved from hunger shelters just by donations from online workers.,0,0,1,0,0,0,0,0
"Oh, great. ",0,0,0,0,0,0,0,1
"Actually, the donation has to be in relation to your payment, what percentage of that are you willing to donate?",0,1,0,0,0,0,0,0
"5%, that wonderful.",1,0,0,0,0,0,0,0
Would you like to make a small donation to the Save the Children organization?,0,1,0,0,0,0,0,0
 I respect that decision.,1,0,0,0,0,0,0,0
I completely understand.,1,0,0,0,0,0,0,0
We have hardships in life that make it impossible to reach out and aid others.,1,0,0,0,0,0,0,0
"You have to take care of yourself first, because no one else will.",1,0,0,0,0,0,0,0
I hope things are able to get better for you.,1,0,0,0,0,0,0,0
"Anyway, I thought the 10 turns would have been up by now.",0,0,0,0,0,0,0,1
I'm guessing 10 per person.,0,0,0,0,0,0,0,1
This is my first and probably last.,0,0,0,0,0,0,0,1
Yep.,0,0,0,0,0,0,0,1
I'm sorry this HIT is intended to pit us against one another for a reward.,0,0,0,0,0,0,0,1
How have you spent your weekend?,1,0,0,0,0,0,0,0
I had to work this morning so it threw me off.,1,0,0,0,0,0,0,0
that will be fun! what industry are you in when you're working?,1,0,0,0,0,0,0,0
my husband is an engineer. Great industry. You'll find a new job in no time. ,1,0,0,0,0,0,0,0
You'll find a new job in no time.,1,0,0,0,0,0,0,0
my husband is an engineer.,1,0,0,0,0,0,0,0
Great industry.,1,0,0,0,0,0,0,0
i hope you get well soon. there has to be some positivity coming your way soon after all this rough stuff.,1,0,0,0,0,0,0,0
i do!,1,0,0,0,0,0,0,0
I have a daughter and a son.,1,0,0,0,0,0,0,0
We are doing a 5k tomorrow.,1,0,0,0,0,0,0,0
how about 5 cents?,0,1,0,0,0,0,0,0
ok great thanks! have a nice weekend. i'll be praying for your health to improve.,1,0,0,0,0,0,0,0
ok great thanks!,1,0,0,0,0,0,0,0
have a nice weekend.,1,0,0,0,0,0,0,0
Hi there !,0,0,0,0,0,0,0,1
"Fine, thank you. Can i get you to do a favor for me? ",0,1,0,0,0,0,0,0
"Fine, thank you.",0,0,0,0,0,0,0,1
I was just thinking that maybe we could take our earnings from the task and mmake  donation to Save the Children... ,0,1,0,0,0,0,0,0
Cool... You're awesome! Thanks for being so generous...,1,0,0,0,0,0,0,0
Cool...,1,0,0,0,0,0,0,0
You're awesome!,1,0,0,0,0,0,0,0
Do you have any kids or are you just wanting to help out just because? ,1,0,0,0,0,0,0,0
I know,1,0,0,0,0,0,0,0
hello,0,0,0,0,0,0,0,1
would you donate,0,1,0,0,0,0,0,0
im saying for children,0,0,0,0,0,0,0,1
to be honest i dont really know,0,0,0,0,0,0,0,1
i use to yes,0,0,0,0,0,0,0,1
that i dont know do you know,0,0,0,0,0,0,0,1
I'm good. so i was wondering if you would be willing to donate some of your earnings along with me to this charity ?,0,1,0,0,0,0,0,0
I'm good.,0,0,0,0,0,0,0,1
"ok, well would you be willing to donate to the charity called save the children ? even just 5 cents ",0,1,0,0,0,0,0,0
"I do not receive any, actually i match every person who donates anything under $20, i also have another job that i work and do this in my free time. ",1,0,0,0,0,0,0,0
i work for a company called gordon food service ,1,0,0,0,0,0,0,0
hello...,0,0,0,0,0,0,0,1
Thank you...,0,0,0,0,0,0,0,1
"yes,what about you?",1,0,0,0,0,0,0,0
"Yes ,are you interested in donating?",0,1,0,0,0,0,0,0
Thank you :),1,0,0,0,0,0,0,0
"I frequently make trips to Uganda for our organization, and on my last visit saw a little boy names Jon about four years old without any clothes or shoes. I found his home; he was living in a ditch dugout without any electricity or running water. Our organization strives to help children like Jon by donating our time, money and resources.  ",0,0,1,0,0,0,0,0
I found his home; he was living in a ditch dugout without any electricity or running water.,0,0,1,0,0,0,0,0
"Our organization strives to help children like Jon by donating our time, money and resources.",0,0,1,0,0,0,0,0
I am glad you understand the severity of his situation. There are so many more out there just like him! I try to donate 10% of my paycheck each month to send over to Ugandan children. I waste so much money on unnecessary things like coffee and donuts that I could be helping someone with!,0,0,1,0,0,0,0,0
I waste so much money on unnecessary things like coffee and donuts that I could be helping someone with!,0,0,1,0,0,0,0,0
I am glad you understand the severity of his situation.,0,0,1,0,0,0,0,0
There are so many more out there just like him!,0,0,1,0,0,0,0,0
"Yes Syria is just as bad. I wish we could help all of them, but all we can help is one at a time with the resources we have. ",0,0,1,0,0,0,0,0
Thanks so much for listening to my story! ,1,0,0,0,0,0,0,0
Yes Syria is just as bad.,0,0,1,0,0,0,0,0
Thats wonderful. Could you spare some of your payment for this task to Save the Children today? We'd appreciate it immensely. ,0,1,0,0,0,0,0,0
"That is wonderful, thank so much.",1,0,0,0,0,0,0,0
Great. Jon will appreciate your gift so much! ,0,0,1,0,0,0,0,0
Great.,0,0,0,0,0,0,0,1
Thanks for contacting Save the Children.,0,0,0,0,0,0,0,1
Hello?,0,0,0,0,0,0,0,1
"Same, would you like to donate to Save the children?",0,1,0,0,0,0,0,0
"For instance, millions of Syrian children have grown up facing the daily threat of violence. In the first two months of 2018 alone, 1,000 children were reportedly killed or injured in intensifying violence. Your donation would be a small part in keeping the children safe from the violence.",0,0,1,0,0,0,0,0
"In the first two months of 2018 alone, 1,000 children were reportedly killed or injured in intensifying violence.",0,0,1,0,0,0,0,0
"For instance, millions of Syrian children have grown up facing the daily threat of violence.",0,0,1,0,0,0,0,0
Your donation would be a small part in keeping the children safe from the violence.,0,0,1,0,0,0,0,0
"Yes, this donation is a one time thing. But if you like to continue donating your welcome to do so, how much would you like to donate?",0,1,0,0,0,0,0,0
"Yes, this donation is a one time thing.",0,0,0,0,0,0,0,1
Thank you,0,0,0,0,0,0,0,1
"Your a great person and thanks again, have a nice day.",1,0,0,0,0,0,0,0
Thats great.,1,0,0,0,0,0,0,0
I try to do a couple hundred a year,1,0,0,0,0,0,0,0
"yes, thank you.",1,0,0,0,0,0,0,0
that is very generous!,1,0,0,0,0,0,0,0
Hi,0,0,0,0,0,0,0,1
Iam Fine.,0,0,0,0,0,0,0,1
Yes I know something about that.,0,0,0,0,0,0,0,1
Yes sure.,0,0,0,0,0,0,0,1
Yes I donate in one year back.,1,0,0,0,0,0,0,0
I donate 50 dollars.,1,0,0,0,0,0,0,0
Will you donate for the charity?,0,1,0,0,0,0,0,0
Wow super how much will you like to donate?,0,1,0,0,0,0,0,0
oh super. Today will you like to donate.,0,1,0,0,0,0,0,0
Oh super Have a nice day.,1,0,0,0,0,0,0,0
hello,0,0,0,0,0,0,0,1
how much would you like to donate?,0,1,0,0,0,0,0,0
"the donation will be user for kids who are poor, no parents, diabilities, to help get them on their feet",0,0,1,0,0,0,0,0
"Save the Children is and how their donation is essential to help ensuring children's rights to health, education, safety, etc.",0,0,1,0,0,0,0,0
Yor donation will make a tangible impact for the world,0,0,1,0,0,0,0,0
over a decade.,0,0,0,0,1,0,0,0
"or instance, millions of Syrian children have grown up facing the daily threat of violence. In the first two months of 2018 alone, 1,000 children were reportedly killed or injured in intensifying violence.",0,0,1,0,0,0,0,0
"""How much do you like to donate to the charity now? Your donation will be directly deducted from your task payment. You can choose any amount from $0 to all your payment ($2)."" ",0,1,0,0,0,0,0,0
how much money do you spend on unnecessary stuff like a bag of snack or candyÿ  that money can be used in more meaningful ways.,0,0,1,0,0,0,0,0
Small donations will indeed help a lot of children and their families,0,0,1,0,0,0,0,0
"""How much do you like to donate to the charity now? Your donation will be directly deducted from your task payment. You can choose any amount from $0 to all your payment ($2)."" ",0,1,0,0,0,0,0,0
I am doing pretty well now that the 3 day weekend has arrived :),1,0,0,0,0,0,0,0
Ok I just want to know a little more about you.,1,0,0,0,0,0,0,0
I hear ya there!,1,0,0,0,0,0,0,0
Wow that is admirable!,1,0,0,0,0,0,0,0
I have donated as well whenever I can. ,1,0,0,0,0,0,0,0
"Because of a lack of support for children in developing countries, especially in war zones.",0,0,1,0,0,0,0,0
"For instance, millions of Syrian children have grown up facing the daily threat of violence.",0,0,1,0,0,0,0,0
"In the first two months of 2018 alone, 1,000 children were reportedly killed or injured in intensifying violence.",0,0,1,0,0,0,0,0
Save the Children is focusing on getting these children into safety.,0,0,1,0,0,0,0,0
"Yes, that is more than acceptable and very generous of you.  ",1,0,0,0,0,0,0,0
"Cool,  I hope you have a good weekend",1,0,0,0,0,0,0,0
Hi there.  Have you ever thought about who the most vulnerable people are when a natural disaster strikes?  Or when there's political unrest?,0,0,1,0,0,0,0,0
Hi there.,0,0,1,0,0,0,0,0
Or when there's political unrest?,0,0,1,0,0,0,0,0
"Actually, I'm really troubled by the answer.  In countries like Syria, 1000 children have been killed during the civil war.  Isn't that insane?",0,0,1,0,0,0,0,0
"Actually, I'm really troubled by the answer.",0,0,1,0,0,0,0,0
Isn't that insane?,0,0,1,0,0,0,0,0
"Seriously.  Adults often can't fend for themselves when there's a crisis, but children are especially vulnerable.  Do you think that if you could do something to help Syrian children or children in Indonesia, which just experienced an earthquake, you would?. ",0,0,1,0,0,0,0,0
"Adults often can't fend for themselves when there's a crisis, but children are especially vulnerable.",0,0,1,0,0,0,0,0
Seriously.,0,0,1,0,0,0,0,0
"Yeah, me too. ",1,0,0,0,0,0,0,0
Can you elaborate.,0,0,0,0,0,0,0,1
"It's actually been around since 1919, when it was founded by this woman in London right after World War I",0,0,0,0,1,0,0,0
"I know I haven't given you that much info, but do you think you might want to donate part of your proceeds for this task to Save the Children?",0,1,0,0,0,0,0,0
I believe so.,0,0,0,0,1,0,0,0
Would you be willing to donate 10 cents? How much would you like to donate?,0,1,0,0,0,0,0,0
You coud always donate more if you prefer,0,1,0,0,0,0,0,0
ME TOO!,1,0,0,0,0,0,0,0
Thank you for considering a donation of 12 whole cents.,0,0,1,0,0,0,0,0
I know what a burden that could be.,0,0,1,0,0,0,0,0
Think of all the meals 12 cents could provide.,0,0,1,0,0,0,0,0
You're the real MVP.  Thank you!,1,0,0,0,0,0,0,0
Thank you!,0,0,0,0,0,0,0,1
Good evening,0,0,0,0,0,0,0,1
"A portion of doantions got to Syria, millions of Syrian children have grown up facing the daily threat of violence. In the first two months of 2018 alone, 1,000 children were reportedly killed or injured in intensifying violence",0,0,1,0,0,0,0,0
"Even a $0.25 will be a huge contribution, and help children around the world",0,0,1,0,0,0,0,0
